"Symptom Type","Reporter Comment"
"1 - Performance Loss","5-E600 platform PCB fault "
"7 - Training","Completed up to copycat."
"1 - Performance Loss","3 pin plug to solenoid was only plugged on 2 pins. Caused a out of water in solution tank issue."
"4 - Quality Issue - Functional","re-inspect at FQC, Need to drive test with detergent pumps installed"
"4 - Quality Issue - Functional","re-inspect at FQC, Need to drive test with detergent pumps installed"
"5 - Quality Issue - Assembly","L/H Side Broom Assyl is missing."
"5 - Quality Issue - Assembly","Side Broom Motors are disconnected."
"5 - Quality Issue - Assembly","Ferrite Kit is missing."
"5 - Quality Issue - Assembly","UV Torque Stripes are not marked on multiple hardware."
"4 - Quality Issue - Functional","Fault 5-E449"
"5 - Quality Issue - Assembly","Look into better cover"
"5 - Quality Issue - Assembly","Screws for camera cover loose"
"4 - Quality Issue - Functional","Solution Hose is leaking at the Solenoid Fitting."
"2 - Quality Issue - Appearance","Roto-Mold Surface ""A"" has dent marks on it."
"5 - Quality Issue - Assembly","L/H Side Broom Links Assyl is rubbing against the Harness."
"5 - Quality Issue - Assembly","Solution Hose is leaking at the Solenoid Fitting."
"5 - Quality Issue - Assembly","loose cable close to drive wheel "
"5 - Quality Issue - Assembly","missing uv marks on  torques "
"2 - Quality Issue - Appearance","Hydraulic Manifold Fitting has residual hydraulic oil on it."
"5 - Quality Issue - Assembly","L/H Side Broom Assyl is not installed."
"5 - Quality Issue - Assembly","The Prop Rod doesn't un-prop when trying to lift the Hopper."
"5 - Quality Issue - Assembly","Dump Door ratcheting before opening. It is closing too tight."
"5 - Quality Issue - Assembly","UV Torque Stripes are not marked on multiple hardware."
"1 - Performance Loss","Missing UVGI harness."
"4 - Quality Issue - Functional","Roller bumper doesn’t spin"
"4 - Quality Issue - Functional","Roller bumper on squeegee doesn’t spin"
"1 - Performance Loss","5-E611 up ramp or motor fail"
"1 - Performance Loss","5-E611 up ramp or motor fail"
"5 - Quality Issue - Assembly","installed upside down "
"2 - Quality Issue - Appearance","Battery Stop Weldt has water stains._Kitty Cat"
"2 - Quality Issue - Appearance","Roto-Mold Surface ""B"" has scratch marks."
"2 - Quality Issue - Appearance","Roto-Mold Surface ""A"" has gouge and scuff marks."
"2 - Quality Issue - Appearance","Oil residue on hydraulic pump."
"2 - Quality Issue - Appearance","Broom Height Decal has stains. Please replaced."
"1 - Performance Loss","Replaced camera"
"1 - Performance Loss","Fault history not cleared "
"5 - Quality Issue - Assembly","missing battery tray and side door "
"1 - Performance Loss","Missing floor mats"
"4 - Quality Issue - Functional","BRAKE ARE NOT WORKING "
"5 - Quality Issue - Assembly","Dump Door doesn't fully close 2/6 times. Please minor adjust the Bracket and make sure the Proximity sensor is cleaned.

Does not pass the JIG Test either. "
"2 - Quality Issue - Appearance","Battery Stop Weldt has water stains._Kitty Cat."
"4 - Quality Issue - Functional","mist spray are not working "
"5 - Quality Issue - Assembly","FILTER-RECTANGULAR SYNTHETIC is missing "
"5 - Quality Issue - Assembly","missing DEBRIS BASKET"
"5 - Quality Issue - Assembly","pull rod is not properly installed "
"5 - Quality Issue - Assembly","gas spring is making a noise "
"5 - Quality Issue - Assembly","Missing squeegee castors left and right"
"2 - Quality Issue - Appearance","Backup alarm decal dirty"
"5 - Quality Issue - Assembly","Production issue left open"
"4 - Quality Issue - Functional","Machine keep stopping "
"5 - Quality Issue - Assembly","MISSING ECOFLEX BOTTLES "
"2 - Quality Issue - Appearance","decal miss placed , uv marks are missing or not mark properly "
"4 - Quality Issue - Functional","Hopper Cover is squeaking when opening and closing."
"5 - Quality Issue - Assembly","side broom is touching the floor
"
"2 - Quality Issue - Appearance","Chassis has dent marks from using the drill incorrectly."
"5 - Quality Issue - Assembly","Recovery Tank Cover Seal is installed inside-out."
"5 - Quality Issue - Assembly","Recovery Tank Cover Hinge is missing hardware."
"5 - Quality Issue - Assembly","Hopper Prop Rod doesn't undo itself after lifting the Hopper from propped position._Kitty Cat."
"2 - Quality Issue - Appearance","Cover Hanger has water stains on it._Kitty Cat."
"4 - Quality Issue - Functional","	leak on the filter under machine "
"2 - Quality Issue - Appearance","Roto-Mold Surface ""A"" has a gouge mark. "
"2 - Quality Issue - Appearance","surface ""A"" has some Excess plastic ,Different color, tone or material,Small holes in the parting line or the body "
"2 - Quality Issue - Appearance","surface ""A"" has some Excess plastic ,Different color, tone or material,Small holes in the parting line or the body "
"2 - Quality Issue - Appearance","surface ""A"" has some Excess plastic ,Different color, tone or material,Small holes in the parting line or the body "
"2 - Quality Issue - Appearance","Rotomold ""Surface A"" damages on Recovery Tank Cover."
"7 - Training","Main 10. Completed Update. Left off at X/Y."
"7 - Training","Tasks done up to calibration for right sensor. "
"7 - Training","EOL: left off at beginning of Copy-Cat. Water is already in the tank."
"1 - Performance Loss","Had to charge due to low battery. Completed 1 copy cat run."
"5 - Quality Issue - Assembly","coolant residue "
"2 - Quality Issue - Appearance","tone difference "
"2 - Quality Issue - Appearance","bubble on decal "
"5 - Quality Issue - Assembly","Left side broom doesn't work"
"5 - Quality Issue - Assembly","Strain relief loose"
"4 - Quality Issue - Functional","Hopper cover squeaks when opening and closing"
"2 - Quality Issue - Appearance","surface "" A "" is showing following defects  = Different color, tone or material,
Texture is different from the surrounding areas ,•	Fish Scales or un-melted pellets ,Excess plastic bubbles on decal 
surface "" C "" coolant residue and a crack from glue 
"
"2 - Quality Issue - Appearance","surface "" A "" is showing following defects  = Different color, tone or material,
Texture is different from the surrounding areas ,•	Fish Scales or un-melted pellets ,Excess plastic bubbles on decal 
surface "" C "" coolant residue and a crack from glue 
"
"2 - Quality Issue - Appearance","surface "" A "" is showing following defects  = Different color, tone or material,
Texture is different from the surrounding areas ,•	Fish Scales or un-melted pellets ,Excess plastic bubbles on decal 
surface "" C "" coolant residue and a crack from glue 
"
"2 - Quality Issue - Appearance","surface "" A "" is showing following defects  = Different color, tone or material,
Texture is different from the surrounding areas ,•	Fish Scales or un-melted pellets ,Excess plastic bubbles on decal 
surface "" C "" coolant residue and a crack from glue 
"
"5 - Quality Issue - Assembly","Hopper cover gasket has 2 cuts"
"4 - Quality Issue - Functional","mist spray not working "
"5 - Quality Issue - Assembly","miss installed "
"2 - Quality Issue - Appearance","extra part under hopper "
"5 - Quality Issue - Assembly","56509525 Panel Weldment 7010 out of them"
"4 - Quality Issue - Functional","Fault code in history"
"5 - Quality Issue - Assembly","Missing beacon light for overhead guard "
"5 - Quality Issue - Assembly","Vac pressure fail!!! Can't clock out VF at main 10"
"1 - Performance Loss","Low voltage on battery. Left to charge."
"2 - Quality Issue - Appearance","Completed EOL. Rework on tank from exterior and interior. "
"1 - Performance Loss","missing engine cover, intermediate cover, and seat support"
"1 - Performance Loss","missing engine cover, intermediate cover, and seat support"
"5 - Quality Issue - Assembly","Prop rod not working right sometimes it does and sometimes it doesn't "
"2 - Quality Issue - Appearance","hopper cover spring squeaks when opening"
"5 - Quality Issue - Assembly","loose torque on wheel Control System"
"4 - Quality Issue - Functional","dust guard not working properly "
"2 - Quality Issue - Appearance","surface "" A "" have scratch and decal too "
"5 - Quality Issue - Assembly","Scrub deck is spinning counter clockwise"
"2 - Quality Issue - Appearance","Front Hood warped."
"5 - Quality Issue - Assembly"," SICK & L/R sensors need recalibration."
"2 - Quality Issue - Appearance","Main Broom Motor Fittings have hydraulic oil residue."
"5 - Quality Issue - Assembly","Switch Kit is missing."
"5 - Quality Issue - Assembly","Flooring Panel is missing."
"5 - Quality Issue - Assembly","Missing Overhead Guard and Beacon Kit."
"3 - Quality Issue - Supplier","Recovery Tank Drain Hose is poorly made, with undeveloped plastic inside."
"2 - Quality Issue - Appearance","Steering Column Shrouds have dirt marks."
"2 - Quality Issue - Appearance","Roto-Mold Surface ""A"" Has scratches, and gouges."
"2 - Quality Issue - Appearance","Roto-Mold Surface ""A"" Has scratches, and gouges."
"5 - Quality Issue - Assembly","Cover is not aligning properly to the Recovery Tank's inserts."
"5 - Quality Issue - Assembly","Missing Debris Basket."
"5 - Quality Issue - Assembly","Front Bumper is installed uneven and has a big gap on one side compared to the other side."
"5 - Quality Issue - Assembly","Side broom and main broom moves by itself without stepping on the gas pedal "
"5 - Quality Issue - Assembly","Gap in dump door seal on right side"
"5 - Quality Issue - Assembly","Loose bolt on left side broom mounting plate"
"4 - Quality Issue - Functional","AUTO MOD NOT RESPONDING."
"5 - Quality Issue - Assembly","Hopper Proximity Sensor is set too far back."
"5 - Quality Issue - Assembly","Hopper Proximity Sensor is set too far back."
"2 - Quality Issue - Appearance","Hanger-Cover has watermark stains."
"2 - Quality Issue - Appearance","Bulb Seal has metal flakes on it."
"4 - Quality Issue - Functional","Recovery Drain Hose cap is binding when trying to open it."
"2 - Quality Issue - Appearance","Hopper Cover R/H Latch is gouging the Hopper Cover when closing."
"5 - Quality Issue - Assembly","Hopper Lift Cylinder lower fitting is loose with Torque Stripe."
"5 - Quality Issue - Assembly","Actuator installed unproperly "
"5 - Quality Issue - Assembly","prop rod is not working properly "
"5 - Quality Issue - Assembly","Fuse Panel & Main Panel are undone. "
"2 - Quality Issue - Appearance","Roto-mold surface ""A"" is dirty."
"2 - Quality Issue - Appearance","Radiator Assyl has white coolant stains on it."
"2 - Quality Issue - Appearance","Dust Fan Weldmnt has water stains on it."
"5 - Quality Issue - Assembly","LPG Fuel tank gets hit by the Seat Assyl when closing it."
"2 - Quality Issue - Appearance","Chassis engine compartment flooring has oil residue all over it."
"2 - Quality Issue - Appearance","Hydraulic Pump Assyl has hydraulic oil residue underneath."
"2 - Quality Issue - Appearance","Hydraulic Manifold Fittings have hydraulic oil residue all over them."
"4 - Quality Issue - Functional","Engine does not turn over. Lights are on, but the Starter doesn't engage."
"5 - Quality Issue - Assembly","Missing uvgi cord"
"3 - Quality Issue - Supplier","Critical Issue: M1 Open, Error code 2-021. "
"1 - Performance Loss","Replaced autonomy/breakout box harness. Previous harness wasn't reading the left drop off sensor correctly."
"1 - Performance Loss","Replaced autonomy/breakout box harness. Previous harness wasn't reading the left drop off sensor correctly."
"5 - Quality Issue - Assembly","missing Eco flex kit "
"2 - Quality Issue - Appearance","left side shows some discoloration , surface ""c"" have some scratches left and right "
"2 - Quality Issue - Appearance","left side shows some discoloration , surface ""c"" have some scratches left and right "
"5 - Quality Issue - Assembly","WRONG DECALS  RIGHT AND LEDT SIDE "
"5 - Quality Issue - Assembly","Wires going to MIL INDICATOR light are cut. "
"5 - Quality Issue - Assembly","missing side panel "
"2 - Quality Issue - Appearance","Both sides of hopper cover are hitting clips"
"5 - Quality Issue - Assembly","MISSING BATTERY TRAY AND SIDE PANEL "
"2 - Quality Issue - Appearance","Dump Door & Hopper Flap are dirty after EOL."
"5 - Quality Issue - Assembly","Mist Spray Kit is not primed."
"5 - Quality Issue - Assembly","Push-Pull Rod Assyl doesn't auto unlatch when trying to lower Hopper."
"5 - Quality Issue - Assembly","MISSING SIDE PANEL AND BATTERY TRAY "
"5 - Quality Issue - Assembly","MISSING SIDE PANEL AND BATTERY TRAY "
"5 - Quality Issue - Assembly","MISSING BATTERY TRAY "
"4 - Quality Issue - Functional","Scrub Deck doesn't actuate down when pressing the Scrub On Button."
"5 - Quality Issue - Assembly","Missing Hopper."
"5 - Quality Issue - Assembly","Missing Debris Tray."
"5 - Quality Issue - Assembly","Missing ECO Flex bottle"
"4 - Quality Issue - Functional","Added washers behind recovery tank latch."
"5 - Quality Issue - Assembly","Missing both broom door decals "
"5 - Quality Issue - Assembly","NO SQUEEGEE."
"4 - Quality Issue - Functional","dusttguard button light wont turn on and same for side brooms light button "
"5 - Quality Issue - Assembly","missing back up alarm bacon and debris tray  "
"2 - Quality Issue - Appearance","surface ""A"" and recovery tank are dirty "
"3 - Quality Issue - Supplier","Critical Issue: Auto speed is not set correctly. "
"3 - Quality Issue - Supplier","Critical Issue: Mapping Sensor and 2D right camera failed spec test. "
"5 - Quality Issue - Assembly","Critical Issue: Mapping Sensor and 2D right camera failed spec test. "
"3 - Quality Issue - Supplier","Critical Issue: Drive wheel chain tension is too tight"
"5 - Quality Issue - Assembly","Critical Issue: Drive wheel chain tension is too tight"
"3 - Quality Issue - Supplier","Critical Issue: Error Code 5-F4B6, No Pattern Projector. Camera Sensor malfunction. "
"5 - Quality Issue - Assembly","Missing hose from sub 5 that connects to the water pump and meter flow."
"3 - Quality Issue - Supplier","Critical Issue: 2D right sensor failed the no go gauge. 
Critical Issue: Mapping Sensor was not set correctly."
"3 - Quality Issue - Supplier","Hopper Prop Rod is stiff and doesn't auto unlatch when lowering the Hopper."
"2 - Quality Issue - Appearance","Oil residue on Hydraulic pump."
"4 - Quality Issue - Functional","leak on the Ecoflex filter "
"2 - Quality Issue - Appearance","loose hose on recovery tank ,uv marks missing and miss placed "
"2 - Quality Issue - Appearance","Rotomold ""Surface A"" Engine Cover damages."
"5 - Quality Issue - Assembly","Missing left side broom motor."
"4 - Quality Issue - Functional","Added washers behind recovery tank latch."
"5 - Quality Issue - Assembly","Right wheel encoder not flushed."
"4 - Quality Issue - Functional","SICK Mapping Sensor calibration were off."
"4 - Quality Issue - Functional","Added washers behind recovery tank latch."
"2 - Quality Issue - Appearance","Active faults and history not cleared"
"5 - Quality Issue - Assembly","Loose hardware on Hopper System."
"5 - Quality Issue - Assembly","Alternator Terminal Boot is not fully installed because the terminals are not correctly positioned to the 10 & 12 o'clock positions per work instructions. "
"5 - Quality Issue - Assembly","Alternator Terminal Boot is not fully installed because the terminals are not correctly positioned to the 10 & 12 o'clock positions per work instructions. "
"7 - Training",
"1 - Performance Loss","missing part to install pull rod"
"1 - Performance Loss","missing part to install pull rod"
"4 - Quality Issue - Functional","Fault code: Right drop-off sensor. Recalibrated and resumed plans. Fault code gone."
"3 - Quality Issue - Supplier","DTC 650: MIL open  -active fault when hot testing machine"
"5 - Quality Issue - Assembly","Brake Pedal Weldt collides with Cover Weldment (56394201) when retracting."
"5 - Quality Issue - Assembly","Brake Pedal Weldt collides with Cover Weldment (56394201) when retracting."
"5 - Quality Issue - Assembly","Alternator Terminal Boot cannot be installed because they are not positioned at the 12 & 10 o'clock positions per Work Instructions."
"5 - Quality Issue - Assembly","New Power Module S/N: 20304B-009261
Old Power Module S/N: 19077B-006271"
"1 - Performance Loss","missing part to install pull rod"
"1 - Performance Loss","missing part to install pull rod"
"2 - Quality Issue - Appearance","Rotomold ""Surface A"" damages/scuff marks on lower hopper."
"5 - Quality Issue - Assembly","Missing UV marks on hardware."
"5 - Quality Issue - Assembly","Coolant bottle not filled,"
"5 - Quality Issue - Assembly","Missing UV mark on strain relief."
"5 - Quality Issue - Assembly","Missing UV marks on hardware."
"4 - Quality Issue - Functional","Requires new Bushings made from Quality to replace Bushing (56111784) on the Scrub System for testing purposes.

Refer to ICAR#125, and email ""RE: SC8000 TFR - 56003926 Loose Bolt in Scrub Deck"""
"2 - Quality Issue - Appearance","Hopper Flaps are dirty from EOL use and not cleaning."
"5 - Quality Issue - Assembly","Dump Door isn't fully closing because the Bracket has not been adjusted at Main 8 yet. "
"3 - Quality Issue - Supplier","Recovery Drain Hose Cap has a hard time uncapping. Please lubricate the seal."
"5 - Quality Issue - Assembly","Alternator Terminal Boot is not fully installed correctly.
Please re-adjust positions of terminals to 12-10."
"5 - Quality Issue - Assembly","Alternator Terminal Boot is not fully installed correctly.
Please re-adjust positions of terminals to 12-10."
"5 - Quality Issue - Assembly","Missing Ferrite Kit."
"1 - Performance Loss","missing mirrors, engine cover, intermediate cover, seat support"
"1 - Performance Loss","missing mirrors, engine cover, intermediate cover, seat support"
"2 - Quality Issue - Appearance","Pilot Machine."
"4 - Quality Issue - Functional","Pilot Machine."
"5 - Quality Issue - Assembly","Pilot Machine."
"5 - Quality Issue - Assembly","Alternator Terminal Boot is not installed.
Alternator Terminals are not installed 12-10 positions per WI."
"5 - Quality Issue - Assembly","Alternator Terminal Boot is not installed.
Alternator Terminals are not installed 12-10 positions per WI."
"2 - Quality Issue - Appearance","Hopper Flaps are dirty."
"4 - Quality Issue - Functional","Drain Hose Cap is having a hard time uncapping. Please lubricate the seal."
"2 - Quality Issue - Appearance","Tape and debris in rec tank"
"5 - Quality Issue - Assembly","Strain relief loose"
"1 - Performance Loss","missing part to install pull rod"
"1 - Performance Loss","missing part to install pull rod"
"1 - Performance Loss","missing parts to install pull rod"
"1 - Performance Loss","missing parts to install pull rod"
"2 - Quality Issue - Appearance","Laser Bracket is DMT due to both left front and side are off from the X and Y."
"1 - Performance Loss","Reading phantom objects with no camera. May have to restart from Track 1 (Mirror). "
"2 - Quality Issue - Appearance","Appearance Issue: Incorrectly decal installation. "
"2 - Quality Issue - Appearance","Appearance Issue: Incorrectly decal installation. "
"2 - Quality Issue - Appearance","Appearance Issue: Paint chipped "
"2 - Quality Issue - Appearance","machine is missing uv marks and some are misplaced, missing side panel and battery tray  "
"5 - Quality Issue - Assembly","machine is missing uv marks and some are misplaced, missing side panel and battery tray  "
"4 - Quality Issue - Functional","Fault code: Right Drop-off Sensor. Recalibrated and resumed plan. Fault code gone."
"5 - Quality Issue - Assembly","recovery lid is loose ,loose cable on top of actuate deck ,missing battery cables ,battery tray and missing side panel "
"5 - Quality Issue - Assembly","recovery lid is loose ,loose cable on top of actuate deck ,missing battery cables ,battery tray and missing side panel "
"2 - Quality Issue - Appearance","machine has some damaged torques dirty squeegees and scratches on front area  "
"2 - Quality Issue - Appearance","machine has some damaged torques dirty squeegees and scratches on front area  "
"2 - Quality Issue - Appearance","machine has some damaged torques dirty squeegees and scratches on front area  "
"5 - Quality Issue - Assembly","No parts since 2 weeks ago.. we had two hot machine the needed to go.. Parts number is 56394101 Lift Arm only for 1100C,40,48"
"4 - Quality Issue - Functional","Fault code: Right Drop-off Sensor. Recalibrated and resumed plan. Fault code gone."
"5 - Quality Issue - Assembly","Wiring Harness is touching the Scrub Deck Links Assyl."
"5 - Quality Issue - Assembly","Decal is installed uneven."
"2 - Quality Issue - Appearance","Engine Exhaust is rubbing against the Panel Weldment."
"5 - Quality Issue - Assembly","Engine Exhaust is rubbing against the Panel Weldment."
"1 - Performance Loss","left off at 150 1124v1-1
"
"1 - Performance Loss","missing hoes for front bumper and no studs to do the X and Y axis "
"1 - Performance Loss","missing hoes for front bumper and no studs to do the X and Y axis "
"4 - Quality Issue - Functional","Added washers behind recovery tank latch."
"1 - Performance Loss","Missing broom door decal "
"5 - Quality Issue - Assembly","missing side engine door"
"5 - Quality Issue - Assembly","VF on MN10 not clocked out, (no recovery tank to measure) need vac pressure amp and pressure"
"2 - Quality Issue - Appearance","Rotomold ""Surface A/B"" has scuff/damages."
"5 - Quality Issue - Assembly","Missing UV marks on Left Main Broom Door's hardware."
"2 - Quality Issue - Appearance","Paint chip on OHG."
"5 - Quality Issue - Assembly","Tie Down Decals in wrong positions. "
"4 - Quality Issue - Functional","Forward max speed only set to 100"
"3 - Quality Issue - Supplier","sdfsdfgsdfg"
"5 - Quality Issue - Assembly","Missing UV marks on debris filter."
"2 - Quality Issue - Appearance","Coolant residue on right wheel."
"2 - Quality Issue - Appearance","Back-up decal is dirty."
"2 - Quality Issue - Appearance","Serial tag decal is damaged."
"2 - Quality Issue - Appearance","Rotomold ""Surface A"" damages on lower hopper."
"2 - Quality Issue - Appearance","Nilfisk Diesel Emission Decal installed incorrectly and damaged."
"5 - Quality Issue - Assembly","Nilfisk Diesel Emission Decal installed incorrectly and damaged."
"2 - Quality Issue - Appearance","Damaged/Dented Hopper Cover right bottom corner."
"2 - Quality Issue - Appearance","Damaged/Dented Hopper Cover right bottom corner."
"5 - Quality Issue - Assembly","MN10 VF not completed, need vac pressure and vac motor amp"
"5 - Quality Issue - Assembly","missing recovery tamk kit"
"5 - Quality Issue - Assembly","Right engine door is miss grill cover."
"5 - Quality Issue - Assembly","Left engine door missing."
"5 - Quality Issue - Assembly","Recovery tank not installed."
"5 - Quality Issue - Assembly","Engine cover assembly not set or tighten."
"5 - Quality Issue - Assembly","Missing UV marks on mirror kit bracket."
"2 - Quality Issue - Appearance","Oil residue on manifold, hoses and hydraulic pump."
"7 - Training","EOL need to start copycat"
"5 - Quality Issue - Assembly","Wire routed incorrectly, fuse should go under red wire"
"5 - Quality Issue - Assembly","Missing serial # in VF"
"5 - Quality Issue - Assembly","Missing spacer"
"1 - Performance Loss","Drive wheel chain is loose"
"1 - Performance Loss","left off at 150 1126v5-2"
"1 - Performance Loss","left off on 160 1210v9-2"
"5 - Quality Issue - Assembly","missing recovery tank kit"
"5 - Quality Issue - Assembly","MN10 VF not clocked out for amperage reading and vac pressure testing."
"5 - Quality Issue - Assembly","Alternator Terminals are not covered properly."
"2 - Quality Issue - Appearance","Dust Filter has a dent."
"5 - Quality Issue - Assembly","Hopper Harness is incorrectly secured."
"5 - Quality Issue - Assembly","Hopper Harness is not secured."
"2 - Quality Issue - Appearance","Roto-Mold Surface ""A"" has a dent mark.
Roto-Mold Surface ""B"" has scratches and pinholes."
"2 - Quality Issue - Appearance","Roto-Mold Surface ""A"" has a dent mark.
Roto-Mold Surface ""B"" has scratches and pinholes."
"2 - Quality Issue - Appearance","Roto-Mold Surface ""A"" has a dent mark.
Roto-Mold Surface ""B"" has scratches and pinholes."
"5 - Quality Issue - Assembly","UV Torque Stripes are not marked on multiple hardware."
"2 - Quality Issue - Appearance","Hands Off Decal needs to be replaced. Looks damaged and ripped."
"4 - Quality Issue - Functional","Seat Support Bracket is damaging/gouging Engine Cover."
"5 - Quality Issue - Assembly","Rear Bracket is not adjusted 90 degrees per Main 4 Work Instructions."
"5 - Quality Issue - Assembly","Hopper Harness is bundled up incorrectly."
"4 - Quality Issue - Functional","Hopper Cover Strut is squeaking when opening & closing."
"2 - Quality Issue - Appearance","Rotomold ""Surface A"" is dirty. Hood & Engine Cover."
"2 - Quality Issue - Appearance","Plate-Tank Guard & Battery Stop Weldt has stains on it."
"4 - Quality Issue - Functional","The nut welded on the SW frame left broom door broke off. Needs to be reworked by Jose in IQC."
"1 - Performance Loss","Test filter"
"2 - Quality Issue - Appearance","Roto-Mold Surface ""A"" has scratch marks."
"5 - Quality Issue - Assembly","UV Torque Stripes are not marked on multiple hardware."
"2 - Quality Issue - Appearance",
"5 - Quality Issue - Assembly","Has strong smell of propane (might have a leak somewhere)"
"5 - Quality Issue - Assembly","Horn doesn't work"
"5 - Quality Issue - Assembly","Missing left main broom door (56107691)."
"5 - Quality Issue - Assembly","Missing Intermediate Cover (56507565)."
"5 - Quality Issue - Assembly","loose hose on solenoid valve "
"5 - Quality Issue - Assembly","loose cable on top of actuate deck "
"5 - Quality Issue - Assembly","missing side panel"
