"Symptom Type","Reporter Comment"
"Part Shortage","tf5t6gyu7hu7h"
"5 - Quality Issue - Assembly","blaaaa"
"Part Shortage","no front engine cover"
"5 - Quality Issue - Assembly","Shaker motor damaged"
"2 - Quality Issue - Appearance","Battery tray is damaged"
"5 - Quality Issue - Assembly","SC6500/N283 the foam acoustical for vacuuming system is showing up"
"5 - Quality Issue - Assembly","SC6500/N283 wrong instructions book it is an ADVANCE MACHINE "
"1 - Performance Loss","SC6500/N283 missing extra headlight kit PL#56314313 according to the LN paperwork "
"Part Shortage","no front engine cover"
"5 - Quality Issue - Assembly","SC6500/N283 the lever-pawl-brake is rubbing the floor welded plate "
"2 - Quality Issue - Appearance","SC8000/O105 has scratches on left side of radiator. "
"4 - Quality Issue - Functional","SC8000/O105 has lots of residual or possible leak under hydraulic pump ."
"4 - Quality Issue - Functional","SC8000/O105 has lots of residual or possible leak under hydraulic pump ."
"Part Shortage","missing right guard bumper  56414135"
"Part Shortage","7765/M749 - Missing decal 56015428, apparently out of stock"
"5 - Quality Issue - Assembly","SC8000/M555 alp tank bracket weldt is not holding on medal "
"2 - Quality Issue - Appearance","SC8000/M555 has scratched on upper column weldt"
"Assembly Issue","The angle of the connection between the elbow fitting (56394088, FTG - BKHD 90 - 8 MORFS), and the Hose (7-33-02260, 50ID 90 drg END 11.75) on the left side of the scrub deck has been causing issues. Doesn't fit underneath cover unless angle is lowered, which will affect quality of the hose itself."
"Assembly Issue","The angle of the connection between the elbow fitting (56394088, FTG - BKHD 90 - 8 MORFS), and the Hose (7-33-02260, 50ID 90 drg END 11.75) on the left side of the scrub deck has been causing issues. Doesn't fit underneath cover unless angle is lowered, which will affect quality of the hose itself."
"4 - Quality Issue - Functional","CS7010/ O105 has little bits of leak from filter "
"5 - Quality Issue - Assembly","CS7010/O105 Pull Rod too tight; need adjustments "
"Part Shortage","no front engine cover"
"Part Shortage","no front cover"
"5 - Quality Issue - Assembly","SC8000/ M555 radiator need adjustment not closing properly."
"4 - Quality Issue - Functional","SC8000/ M555 has a serious leak from one of the hydraulic hose and fitting on the hydraulic valve block assy. This need to be rework before FQC can start it inspections…. "
"5 - Quality Issue - Assembly","SC8000/M497 has residue under hydraulic pump, and or possible leak."
"Assembly Issue","SC8000/M555 - Missing under hopper because plastic isn't fitting well for metal filter."
"5 - Quality Issue - Assembly","SC8000/M497 recovery tank arm resting on hydraulic hose "
"5 - Quality Issue - Assembly","Hopper flap damage"
"5 - Quality Issue - Assembly","CS7010/O104 pull rod need adjustment, too tight."
"5 - Quality Issue - Assembly","CS7010/ O104 Spring, compression installed in wrong position. (56171123)"
"5 - Quality Issue - Assembly","CS7010/O104 both side broom has loose washer on broom motor mount weldment."
"2 - Quality Issue - Appearance","CS7010/ O104 has paint scratched on it cylinder - hydraulic (56509377)"
"5 - Quality Issue - Assembly","Missing decal on solution tank lid"
"5 - Quality Issue - Assembly","Missing Battery cables stop mechanism"
"5 - Quality Issue - Assembly","Neutral set up malfunction."
"4 - Quality Issue - Functional","7765/M752 scrub deck have some residue left or potential leak needs to be cleaned at tested "
"2 - Quality Issue - Appearance","7765/M752 oil residue under the auxiliary pump  "
"Assembly Issue","Significant amount of paint cracking/peeling on left side near curved arm (56111926), also on the left side around the opening for the Tee fitting (56394085)"
"Part Shortage","no batteries  56388582"
"2 - Quality Issue - Appearance","SC6500/P095 solution tank have sharp edges "
"5 - Quality Issue - Assembly","SC6500/P095 water sensor harness is loose "
"Assembly Issue","7765/M752 - Hopper shaking is pretty visible, not sure if passable or not."
"Assembly Issue","7765/M752 - Tank cover is hitting side of tank."
"5 - Quality Issue - Assembly","SC6500/P134 missing one ferrite kit left/front side of chassis"
"5 - Quality Issue - Assembly","SC6500/P134 missing one ferrite kit left/front side of chassis "
"5 - Quality Issue - Assembly","SC6500/P134 zip tie not cut "
"5 - Quality Issue - Assembly","SC6500/P134 missing side skirts "
"Part Shortage","missing batteries    part #56388582 three are on the machine"
"Part Shortage","no front engine cover"
"Assembly Issue","P134-Sc6500- Leaking water from valve "
"5 - Quality Issue - Assembly","CS7010/M951 bolt for the panel weldment (PL#56509525) is loose  "
"3 - Quality Issue - Supplier","CS7010/M951 Rod-Prop seat not free falling "
"5 - Quality Issue - Assembly","CS7010/O073 Serial number can not be found screenshot."
"Assembly Issue","floor panel top screw head broke off in the insert."
"5 - Quality Issue - Assembly","CS7010/ O073 Left side broom upper LT arm assy and lower LT arm assy touching. See picture."
"Part Shortage","front engine cover
"
"5 - Quality Issue - Assembly","Valve it’s touching the hose clamp"
"5 - Quality Issue - Assembly","Latch does not lock properly"
"5 - Quality Issue - Assembly","CS7010/O073 missing overhead decal."
"5 - Quality Issue - Assembly","CS7010/ M950 left side broom upper LT arm assy and lower LT arm assy are touching…see photo."
"5 - Quality Issue - Assembly","CS7010/ M950 has loose hopper strain relief."
"5 - Quality Issue - Assembly","CS7010/M950 missing decal- E power embossed on the right side of the machine."
"5 - Quality Issue - Assembly","CS7010/M950 missing decal- hopper safety support ( 56510727)"
"Part Shortage","no front engine cover"
"Part Shortage","no front engine cover"
"5 - Quality Issue - Assembly","Missing rec tank prop rod"
"Assembly Issue","CS7010-O074-no red water to prime machine "
"Assembly Issue","CS7010-O073-no red water to prime machine "
"Part Shortage Escalation","SCREW
"
"5 - Quality Issue - Assembly","Paint scratches "
"5 - Quality Issue - Assembly","Shaker motor wires not plugged in"
"2 - Quality Issue - Appearance","Spray painted "
"5 - Quality Issue - Assembly","Loose hardware "
"5 - Quality Issue - Assembly","Loose hardware"
"Assembly Issue","FL914 sc50 Liberty - led light doesnt work "
"Assembly Issue","FL914 sc50 Liberty - led light doesnt work "
"Assembly Issue","FL914 sc50 Liberty - water leaking from crossover hose / front bumper "
"Assembly Issue","FL914 sc50 Liberty - water leaking from crossover hose / front bumper "
"Part Shortage","no front engine cover"
"Part Shortage","no front engine cover"
"5 - Quality Issue - Assembly","M362: loose hose from dump door actuator. Make sure to tighten and reapply orange torque seal."
"5 - Quality Issue - Assembly","M362: plug for hot test is not plug together."
"5 - Quality Issue - Assembly","FL913: no UV mark from upper sprocket for quality alert."
"1 - Performance Loss","FL913: Machine statues for LN need to be complete. Will review with Zach or Danielle."
"Assembly Issue","SW8000-M362-lever for broom is loose"
"Part Shortage","Parts Shortage - Thumb Nut"
"2 - Quality Issue - Appearance","SC6500/ P094 has a deep scratch on recovery tank. See photo "
"2 - Quality Issue - Appearance","SC6500/ P094 has a deep scratch on recovery tank. See photo "
"5 - Quality Issue - Assembly","SC6500/ N275 right side broom touching floor, too low."
"5 - Quality Issue - Assembly","SC6500/ N275 solution tank cover  lid not properly closing."
"5 - Quality Issue - Assembly","SC6500/ N275 missing decal ( 56016163) decal no step."
"Part Shortage","CS7010 - Missing dump door for hopper."
"Part Shortage","no front engine cover"
"Assembly Issue","FL913 sc50 Liberty - after updating machine . fault code 3-011 / Main driver open popped up . "
"2 - Quality Issue - Appearance","CS7010/M967 big scratch on surface B of recovery tank "
"Assembly Issue","N275-Sc6500- Leaking from solenoid valve"
"Assembly Issue","N275-Sc6500- Roller bumper installed incurred right side"
"Assembly Issue","N275-Sc6500- Hopper strap is loose needed to be tight "
"Part Shortage","no front engine cover"
"5 - Quality Issue - Assembly","Backup alarm should not be installed"
"Part Shortage","MISSING side  broom cs7010"
"Assembly Issue","CS7010-O073-can not do hot test because it says it can not read the ECU "
"Assembly Issue","sc6500/P135 screw head snapped off cannot remove"
"4 - Quality Issue - Functional","M470: when machine is turned on left Side broom rotate counter clockwise. Nic advise to check on hose and left cylinder."
"2 - Quality Issue - Appearance","M470: scratches on seat assembly. "
"2 - Quality Issue - Appearance","SC6500/ P235 has damaged packing decal. See photo attached."
"2 - Quality Issue - Appearance","SC6500/ P235 has damaged packing decal. See photo attached."
"2 - Quality Issue - Appearance","M470: pin hole on cover center."
"5 - Quality Issue - Assembly","SC6500/P066 missing hose assembly  (56220035) and wand assembly (56314402) for kit - spray wand (56413687) see photos attached."
"4 - Quality Issue - Functional","O071: radiator is leaking coolant. May have to replace it. "
"5 - Quality Issue - Assembly","O071: loose engine drain hose."
"2 - Quality Issue - Appearance","O071: multiple scratches on plate inlet from solution tank B surface. Ask assembler from sub 9 and part will come as none or minor to multiple scratches."
"5 - Quality Issue - Assembly","O071: wrong decals on both side for advance machine."
"5 - Quality Issue - Assembly","O071: loose screw from circuit break panel."
"Part Shortage","no front engine cover.
"
"Part Shortage","No front engine cover"
"5 - Quality Issue - Assembly","Foreign object "
"5 - Quality Issue - Assembly","SW8000/M470 latch for intermediate cover is too tight, potential risk of getting broke 
 "
"2 - Quality Issue - Appearance","SW8000/M470 broken zip tie left inside the machine "
"2 - Quality Issue - Appearance","SW8000/M470 console has some scratches next to the gauge panel assy"
"Assembly Issue","P235-SC6500- Deck wont go all the way down due to bad Actuator not setting currently "
"2 - Quality Issue - Appearance","SW8000/M470 front chassis have some paint coming off "
"4 - Quality Issue - Functional","M438: possibly leak or just residue. Please check and verify if it is tighten."
"5 - Quality Issue - Assembly","M438: missing bush from right side skirt."
"5 - Quality Issue - Assembly","M438: broken orange torque seal from main broom left side."
"5 - Quality Issue - Assembly","SC800/M646 scratching on cover support assys might hitting with some metal "
"5 - Quality Issue - Assembly","M438: missing orange torque seal and some need to apply more seal from main broom."
"Assembly Issue","SW8000/M470 - Lever for main broom is loose."
"Assembly Issue","FL916 sc50 Liberty - water leaking from front bumper cross hose "
"Assembly Issue","FL916 sc50 Liberty - water leaking from front bumper cross hose "
"5 - Quality Issue - Assembly","SC800/M646 the pin tapered is scratching  the cover support assy holes "
"5 - Quality Issue - Assembly","SC800/M646 it looks like it might be missing bushings "
"5 - Quality Issue - Assembly","SC800/M646 looks like spray paint is left on one of the hydraulic hose on main broom "
"5 - Quality Issue - Assembly","SC800/M646 left idler assembly (PL#56110752) needs adjustment "
"5 - Quality Issue - Assembly","SC800/M646 round metal item left on the LP tank magnet latch holder "
"5 - Quality Issue - Assembly","SC800/M646 debris on ecoflex compartment "
"5 - Quality Issue - Assembly","SC6500/P234 recovery tank is hitting solution tank, can this be adjusted ?"
"5 - Quality Issue - Assembly","SC6500/P234 stripped bold on solution tank lid "
"5 - Quality Issue - Assembly","SC6500/P234 missing holes for beacon kit "
"5 - Quality Issue - Assembly","SC6500/P234 battery connector are loose please double check those "
"4 - Quality Issue - Functional","SC8000/M438 has lot of residue on main broom motor and fittings or possible leak."
"5 - Quality Issue - Assembly","SC8000/ M438 recovery tank left arm sitting on hydraulic hose or fittings."
"5 - Quality Issue - Assembly","P066: loose battery cable."
"5 - Quality Issue - Assembly","P066: missing option for kit spray wand 56413687."
"2 - Quality Issue - Appearance","M463: dent on seat assembly."
"5 - Quality Issue - Assembly","M463: plugs for hot test is not plug together."
"2 - Quality Issue - Appearance","M463: strain relief is damage."
"2 - Quality Issue - Appearance","M463: residue or possible leak from steering cylinder assemble."
"Assembly Issue","N260 SC6500 - fault code 03 popped up and shut off scrub deck when testing machine. "
"Assembly Issue","N260 sc6500 - front panel keeps slipping off of latch "
"Assembly Issue","N260 sc6500 - front panel keeps slipping off of latch "
"Assembly Issue","N260 sc6500 - no battery cable kit "
"Assembly Issue","N260 SC6500 - Brake cable is probably to tight causing machine to brake without stepping on brake "
"5 - Quality Issue - Assembly","Fitting from oil pan leaking "
"5 - Quality Issue - Assembly","Rear Squeegee loose"
"2 - Quality Issue - Appearance","P018: scratch on recovery tank."
"5 - Quality Issue - Assembly","O099: main door does not latch twice. Needed to force the door to latch twice."
"5 - Quality Issue - Assembly","Fault code history not cleared."
"5 - Quality Issue - Assembly","Missing option 56109463"
"Assembly Issue","SW8000/O099 - Mist kit pump is leaking."
"5 - Quality Issue - Assembly","SC6500/P018.  The  right side rubber stop for the deck, has more compression then left side "
"Assembly Issue","SW98000/O099 - Lever is lose."
"5 - Quality Issue - Assembly","SC6500/P018 the vacuum hose are sticking out more then what they are supposed to be "
"4 - Quality Issue - Functional","SC6500/P018 steering wheel chain needs to be adjusted, it is to tight and is causing that the wheel when is turn all the way right and u let the steering wheel go, it won’t come back to straight position "
"5 - Quality Issue - Assembly","M702: missing two orange torque seal."
"2 - Quality Issue - Appearance","M702: b surface recovery tank need to be retouch on light grey paint."
"5 - Quality Issue - Assembly","M702: missing orange torque seal hydraulic pump."
"2 - Quality Issue - Appearance","SC6500/PO46 has scratches on  steering lower column weldment (56414084) and also scratches on decal, Packing brake ( 56016401). See photo "
"2 - Quality Issue - Appearance","SC6500/PO46 has scratches on  steering lower column weldment (56414084) and also scratches on decal, Packing brake ( 56016401). See photo "
"Assembly Issue","SW8000/O099 - Intermediate cover isn't lining up and engine cover is hitting intermediate cover."
"4 - Quality Issue - Functional","P018: Dual Vacuum when seal cause for low PSI pressure was the two motors were not adjust evenly when installing. AJ from 254 line adjust it correctly and PSI pressure read over 58 PSI. "
"Assembly Issue","P018-Sc6500- Vacuum sealed fail due to low pressure its under 55 which its too low!  and also its a dual vac"
"Assembly Issue","P018: Vacuum Pressure of Dual Vac System when seal, it read 55 however work instruction does not inform the value. But when entering value, it requires 58 or more. Verified by Benson. Must review with engineer."
"5 - Quality Issue - Assembly","Hardware  installed wrong"
"5 - Quality Issue - Assembly","Paint scratches on safety bar’"
"5 - Quality Issue - Assembly","SC6500/N206 vacuum hose is coming out more then normal"
"5 - Quality Issue - Assembly","SC6500/ N206 stopper for the right side skirt is way too low and that causing the right skirt to look higher then the left side skirt."
"5 - Quality Issue - Assembly","SC6500/ N206 stopper for the right side skirt is way too low and that causing the right skirt to look higher then the left side skirt."
"Assembly Issue","FL915 sc50 Liberty - all torque Guns are being calibrated so all the torque impacts are down on 266 line . "
"5 - Quality Issue - Assembly","SC6500/N206 Solution tank cover lid don’t stay close, kinda loose."
"5 - Quality Issue - Assembly","SC6500/N206 Solution tank cover lid don’t stay close, kinda loose."
"5 - Quality Issue - Assembly","FL895: loose grey plug. Missing zip tie."
"4 - Quality Issue - Functional","CS7010/O008 it has a small leak coming from the ecoflex hose pump "
"2 - Quality Issue - Appearance","CS7010/O068 Right side skirt plate- Catch (56510139) has paint scratch"
"5 - Quality Issue - Assembly","O069: dump door fail jig when closing."
"5 - Quality Issue - Assembly","CS7010/ O068  Loose washer on right side broom weldment . See photo"
"5 - Quality Issue - Assembly","CS7010/O068 standard seat Rod- Prop( 56394235) not falling up and down."
"5 - Quality Issue - Assembly","CS7010/O068 standard seat Rod- Prop( 56394235) not falling up and down."
"Assembly Issue","N206-Sc6500- We had a Rotor sample #4 fit up from jerry! its a passed for us EOL"
"Part Shortage","CS7010/O069 - Missing overheard guard support for overhead guard kit."
"2 - Quality Issue - Appearance","7765/M640 hopper dump door scratches inside hopper. Possible cause could be, dump door not evenly installed there’s a gap on dump door from the left side."
"2 - Quality Issue - Appearance","7765/M640 hopper dump door scratches inside hopper. Possible cause could be, dump door not evenly installed there’s a gap on dump door from the left side."
"5 - Quality Issue - Assembly","7765/M640 has two loose screws and bolts under solution tank chassis. See photo "
"Assembly Issue","N206-Sc6500- Missing kit vacuum motor/ its a duel vac!"
"2 - Quality Issue - Appearance","7765/M640 hopper dump door scratches inside hopper. Possible cause, dump door not evenly installed, there’s a gap on the left side of the dump door."
"Part Shortage","CS7010/O068 - Missing overhead guard support for overhead guard."
"Assembly Issue","CS7010/O068 - keeps smelling like propane so maybe it might be leaking."
"2 - Quality Issue - Appearance","7765/M640 has scratches on radiator weldment."
"2 - Quality Issue - Appearance","SC6500/N200 has scratches on machine including side panels…."
"5 - Quality Issue - Assembly","SC6500/N200 Solution tank cover lid not closing correctly."
"Assembly Issue","SC8000/M236 - Mist kit wiring isn't connected which causes mist kit to not spray."
"5 - Quality Issue - Assembly","SC6500/ N200 Missing option for kit spray wand ( 56413687). Which causing pump motor to come on automatically when switch on machine."
"Part Shortage","511919 heat shield"
"Part Shortage","missing hopper cover cs7010      "
"5 - Quality Issue - Assembly","FL894: missing zip tie for single ground wire (green)."
"5 - Quality Issue - Assembly","FL894: loose cable connector from autonomous."
"Assembly Issue","FL894 sc50 Liberty - sub 2 and main 9 is still open on the line "
"Part Shortage","CS7010-O008-part shortage of support for the over head guard "
"Assembly Issue","N200-Sc6500-top cover screw was loose all 5!"
"5 - Quality Issue - Assembly","M768: loose screw from interface panel. Common issue. Need to address assembler and work instructions."
"5 - Quality Issue - Assembly","M768: seat support stand is not free falling. Should be loose."
"4 - Quality Issue - Functional","CS7010/M767 hydraulic pump reservoir has a loose hose causing leak , see photo."
"4 - Quality Issue - Functional","CS7010/M767 hydraulic pump reservoir has a loose hose causing leak , see photo."
"5 - Quality Issue - Assembly","CS7010/M767 Rod-Prop (56394235) not falling up and down "
"5 - Quality Issue - Assembly","CS7010/M767 Rod-Prop (56394235) not falling up and down "
"Assembly Issue","FL894 sc50 Liberty - 5-E409 obstructed left prox , 5-F5B4 no obstacle detect . had already wipe sensors down ,resent planned ,and check calibration same fault codes pop up "
"Assembly Issue","FL894 sc50 Liberty -  having connection issues with the trackunit website, so cant pair track clean to machine ."
"2 - Quality Issue - Appearance","Upper hopper discoloration "
"5 - Quality Issue - Assembly","Lose , cross-threaded  and stripped bolt."
"2 - Quality Issue - Appearance","O103: scratches on interior metal plate from solution tank."
"2 - Quality Issue - Appearance","O103: filter has left over debris."
"Assembly Issue","M768/CS7010 Drive wheel is unresponsive when steering right."
"5 - Quality Issue - Assembly","O103: loose screw from interface panel."
"5 - Quality Issue - Assembly","SC6500/N205 recovery tank needs to be adjusted it "
"5 - Quality Issue - Assembly","SC6500/N205 solution tank lid needs to be grind for properly fit, easy to open "
"5 - Quality Issue - Assembly","SC6500/P026 recovery tank needs adjustment, it is seating on solutions tank corners and is leaving a gap "
"5 - Quality Issue - Assembly","SC6500/P026 solution tank lid needs to be grind for properly fit, it won’t stay close "
"4 - Quality Issue - Functional","SC6500/N205 have a leak coming from the spray wand connection "
"5 - Quality Issue - Assembly","SC6500/N205 solution tank lid needs to be grind for properly fit "
"4 - Quality Issue - Functional","SW8000/M444 door broom RT WELDT is hitting the chassis latch pin "
"4 - Quality Issue - Functional","SW8000/M444 bracket-sear latch is grinding the chassis bolt latch "
"Assembly Issue","FL893 SC50 Liberty - having connection issues with the trackunit website, so cant pair track clean to machine ."
"5 - Quality Issue - Assembly","M444: seat assy is not align and metal latch is grinding with guide bracket."
"Assembly Issue","CS7010/O103 - Machine suddenly slows down at time out of nowhere even when you're stepping on the gas pedal."
"2 - Quality Issue - Appearance","M444: tiny metal scrap next to battery."
"5 - Quality Issue - Assembly","M444: latch from left side is missing pin to latch with the hook. "
"5 - Quality Issue - Assembly","M444: when closing main door, must force for latch to click twice."
"5 - Quality Issue - Assembly","M444: can not unplug seat."
"4 - Quality Issue - Functional","SC6500/ N205 Kit spray wand motor comes on automatically when machine switches on. Possible cause, because of missing kit spray wand not yet installed."
"5 - Quality Issue - Assembly","SC6500/N205 Missing option for Kit spray wand. Part numbers: (56413687). See photo "
"Assembly Issue","SW8000/M444 - Timer for front panel is upside down."
"4 - Quality Issue - Functional","O102: hopper had antifreeze and it was leaking. "
"5 - Quality Issue - Assembly","O102: missing EOL hot test screen shot."
"5 - Quality Issue - Assembly","SC6500/N272 missing manual book instruction "
"5 - Quality Issue - Assembly","SC6500/N272  solution tank lid needs to be adjusted easy to pop up "
"5 - Quality Issue - Assembly","Broken zip tie in scrub deck area"
"5 - Quality Issue - Assembly","CS6500/N272 missing holes for the beacon kit "
"5 - Quality Issue - Assembly","SC6500/N272 missing the new ecoflex bottle "
"2 - Quality Issue - Appearance","SC6500/N272 sticky tag left on front of solution tank "
"4 - Quality Issue - Functional","CS7010/M858 the white plastic support for the scrub deck needs to be replaced it "
"5 - Quality Issue - Assembly","SC6500/N273 recovery  tank needs to be adjusted, there is a gap between the side panel support and recovery tank "
"5 - Quality Issue - Assembly","SC50/FL912 has wrong gate way IOT installed on machine."
"2 - Quality Issue - Appearance","SC6500/N273 sticky tag left on recovery tank "
"5 - Quality Issue - Assembly","SC6500/N273 missing holes for beacon kit "
"5 - Quality Issue - Assembly","SC6500/N273 steering wheel feels tightened when turning right chain will needs to be adjusted "
"Assembly Issue","N272 Sc6500 - was told to just wash and clean machine because it has been tested already - EOL BV "
"2 - Quality Issue - Appearance","FL911: decal is damage for battery cable charger."
"4 - Quality Issue - Functional","CS7010/M858 scrub deck is not installed properly, left side looks higher then right side and (withe plastic) is all the way up, it does not looks like the work instructions calls "
"1 - Performance Loss","CS7010/M858 missing LP tank TAG (because this machine had an issue with the engine some how we lost the lp tank tag) "
"Assembly Issue","FL892 SC50 Liberty - drive wheel motor whine very loud "
"5 - Quality Issue - Assembly","SW8000/M443 main broom decal is cricked "
"5 - Quality Issue - Assembly","SW8000/M443 screw on broom lift assy plate is not screwed all the way down "
"2 - Quality Issue - Appearance","SW8000/M443 tape and oil residue left inside the machine next to "
"2 - Quality Issue - Appearance","FL912: drain hose is damaged which cause a water leak. Poor design. Need to replace drain hose."
"4 - Quality Issue - Functional","Liberty SC50/FL911 Came in FQC with very low battery 2%...causing delay inspection."
"4 - Quality Issue - Functional","Liberty SC50/FL911 Came in FQC with very low battery 2%...causing delay inspection."
"Assembly Issue","water leak from valve solenoid (56394397)"
"5 - Quality Issue - Assembly","Liberty SC50/ FL911 loose harness REV B on squeegee."
"Assembly Issue","hopper cover hits hopper when close "
"2 - Quality Issue - Appearance","Liberty SC50/FL911 has scratches outside of recovery tank front."
"2 - Quality Issue - Appearance","Liberty SC50/FL911 has scratches outside of recovery tank front."
"1 - Performance Loss","SC50/FL912 is missing the orange work order paperwork "
"Assembly Issue","FL892 sc50 Liberty - sub 2 is still open on 266 line "
"5 - Quality Issue - Assembly","CS7010/M953 the prop rod from seat is not free falling "
"Assembly Issue","large scratch on rear side panel and pin holes on recovery tank."
"5 - Quality Issue - Assembly","CS7010/M953 missing one of the bottles from the ecoflex "
"5 - Quality Issue - Assembly","CS7010/M953 was missing debris basket it was add on the middle of inspection "
