"Symptom Type","Reporter Comment"
"5 - Quality Issue - Assembly","Red boot cable has to be at 10 and 12 o’clock angle. Please see photo or ask Benson."
"5 - Quality Issue - Assembly","steering chain is loose "
"5 - Quality Issue - Assembly","Headlights are off angle. Should be between 18-22. Both are over 22. Please see photos or ask benson."
"5 - Quality Issue - Assembly","Gasket seal sharp edge is facing out which should be facing in. Assemblers should be aware of this and it’s on work instructions."
"5 - Quality Issue - Assembly","Loose Steering Chain."
"4 - Quality Issue - Functional","hopper rod stopper will not pull out."
"2 - Quality Issue - Appearance","Notes written on rec tank 🤦‍♂️"
"5 - Quality Issue - Assembly","Loose knob from squeegee. Please see video."
"1 - Performance Loss","Different colored hoses are installed on machine."
"5 - Quality Issue - Assembly","Dust Guard Assembly is not primed nor tested."
"5 - Quality Issue - Assembly","R/H Side Broom Assembly arms are touching."
"5 - Quality Issue - Assembly","Loose plug, should be zip tie"
"5 - Quality Issue - Assembly","Missing UV marks. Please see photos. "
"5 - Quality Issue - Assembly","Decal sticker for backup alarm need a new sticker, will not stick on weld net and decal sticker from main broom side door has bumbles. "
"5 - Quality Issue - Assembly","scrub deck does not scrub "
"4 - Quality Issue - Functional","Solution Valve is leaking from the Adhesive. Incorrect Adhesive is applied onto this machine."
"5 - Quality Issue - Assembly","Exhaust Shield has loose hardware."
"5 - Quality Issue - Assembly","Recovery Tank is binding against the Chassis when accessing Battery Compartment.
Recovery Tank needs to be pushed to the rear a bit to make a gap."
"5 - Quality Issue - Assembly","missing  Splash Curtain & contactor cover from MAIN 9 he forgot about it "
"5 - Quality Issue - Assembly","Missing Advance Logo Decal."
"5 - Quality Issue - Assembly","Incorrect Logo Decals are installed. This is a US Domestic Machine with Nilfisk Decals. Please replace them with Advance Decals."
"5 - Quality Issue - Assembly","no vac pressure"
"1 - Performance Loss","Missing Side Broom Pins (56413845). Warehouse are out of stock."
"5 - Quality Issue - Assembly","Side Brooms are missing."
"5 - Quality Issue - Assembly","Engine Cover hits Roller Corner Guard when opening/closing."
"5 - Quality Issue - Assembly","Missing Ball Float Assembly."
"4 - Quality Issue - Functional","front left broom is touching the ground even when the broom is not on."
"5 - Quality Issue - Assembly","Solution Hose P-Clamp is installed incorrectly per Work Instructions."
"5 - Quality Issue - Assembly","Beacon Kit is missing."
"5 - Quality Issue - Assembly","MO#100096025 needs to be active to be able to clock out in LN."
"4 - Quality Issue - Functional","back right light is not working."
"5 - Quality Issue - Assembly","MISSING ZIP TIE ON HARNESS BOTTOM LEFT CORNER."
"5 - Quality Issue - Assembly","MISSING PINS FOR SIDE BROOM."
"5 - Quality Issue - Assembly","RECOVERY TANK BOTTOM LEFT BRACKET LOOSE..."
"4 - Quality Issue - Functional","With the new update system 5.02, machine runs 2-3 faster during Track 1 to Fill-In."
"5 - Quality Issue - Assembly","EBRAKE DOESNT FUNCTION CORRECTLY."
"5 - Quality Issue - Assembly","FRONT DECAL NOT CENTER "
"5 - Quality Issue - Assembly","MISSING ZIP TIE ON HARNESS BOTTOM RIGHT CORNER."
"4 - Quality Issue - Functional","New update for system: 5.02. May have change the Charger Algo to 173 instead of 43."
"5 - Quality Issue - Assembly","need adjustment on recovery tank."
"5 - Quality Issue - Assembly","SIDE PANEL DOESNT FIT."
"5 - Quality Issue - Assembly","FRONT DECAL NOT CENTER OUT "
"5 - Quality Issue - Assembly","MISSING ZIP TIE ON HARNESS, BACK OF MACHINE"
"5 - Quality Issue - Assembly","MISSING DECAL "
"1 - Performance Loss","Missing BOM document form."
"4 - Quality Issue - Functional","unable to set the dump door actuator bracket due to a fault code 2-057"
"4 - Quality Issue - Functional","unable to set the dump door actuator bracket due to a fault code 2-057"
"4 - Quality Issue - Functional","unable to set the dump door actuator bracket due to a fault code 2-057"
"5 - Quality Issue - Assembly","Gasket seal is in wrong position. Sharp edge should be facing in, not out. "
"5 - Quality Issue - Assembly","missing side squeegee"
"5 - Quality Issue - Assembly","Latch for main side broom door is difficult to open. Can be loose if re-adjust it."
"5 - Quality Issue - Assembly","missing lit. pack."
"5 - Quality Issue - Assembly","Machine has mix-matched colored hoses installed."
"2 - Quality Issue - Appearance","Missing UV marks on bolts and clamps. Please see photos or ask Benson."
"2 - Quality Issue - Appearance","Bubbles on decal stick."
"4 - Quality Issue - Functional","Vacuum Test failed. The Vacuum wasn't strong enough to provide only 5 psig. The Vac Cover wasn't sealing properly. "
"5 - Quality Issue - Assembly","Solution system not working. Please see photos."
"5 - Quality Issue - Assembly","Negative Battery Cable is loose."
"5 - Quality Issue - Assembly","Solution Hose P-Clamp is installed in the wrong position."
"3 - Quality Issue - Supplier","Oxygen Sensor was disconnected previously to being tested."
"5 - Quality Issue - Assembly","Post cat sensor from harness is not plug or connect."
"4 - Quality Issue - Functional","Vacuum system isn't strong enough to pick up water off the ground."
"4 - Quality Issue - Functional","Active Fault Code: 1-300"
"1 - Performance Loss","Machine has mix-matched colored hoses installed."
"1 - Performance Loss","Left Side Broom Assembly is not installed."
"4 - Quality Issue - Functional","control panel won't power on"
"4 - Quality Issue - Functional","control panel won't power on"
"5 - Quality Issue - Assembly","Hopper Cover Seal (56509406) is installed incorrectly. Refer to 252/Sub 3, Page 33."
"5 - Quality Issue - Assembly","Hopper Cover Seal (56509406) is installed incorrectly. Refer to 252/Sub 3, Page 33."
"5 - Quality Issue - Assembly","Hopper Cover Seal (56509406) is installed incorrectly. Refer to 252/Sub 3, Page 33."
"4 - Quality Issue - Functional","Machine not proceeding plan from track 1 mirror test. Please see video."
"4 - Quality Issue - Functional","Machine not proceeding plan from track 1 mirror test. Please see video."
"4 - Quality Issue - Functional","Machine not proceeding plan from track 1 mirror test. Please see video."
"5 - Quality Issue - Assembly","Machine not prime."
"5 - Quality Issue - Assembly","Main side broom door: not clicking twice when closing and lack is difficult when opening."
"5 - Quality Issue - Assembly","Missing Ferrite kit from main harness "
"5 - Quality Issue - Assembly","Dump door fail Gap Jig when close. Please see photos."
"5 - Quality Issue - Assembly","Missing UV light marks. Please photos or ask Benson."
"5 - Quality Issue - Assembly","leak from under machine even when machine is off"
"5 - Quality Issue - Assembly","recovery tank lid screw is loose PL 56002859"
"5 - Quality Issue - Assembly","rear squeegee not assemble right  "
"5 - Quality Issue - Assembly","recovery hose lid is hard to open and close it "
"5 - Quality Issue - Assembly","Main side broom door: is not clicking twice when closing and difficulty to unlatch when open."
"5 - Quality Issue - Assembly","MISSING ZTR DECALS "
"5 - Quality Issue - Assembly","missing ZTR option  PL 56394626"
"5 - Quality Issue - Assembly","missing BOM paper work , only got the LN "
"5 - Quality Issue - Assembly","Missing document of BOM."
"5 - Quality Issue - Assembly",
"5 - Quality Issue - Assembly","Emergency brake is difficult to step on and it's loose. Please see video or ask Benson."
"5 - Quality Issue - Assembly","Dump Door fail the NO-GO fixture, so there's a gap on the right side."
"5 - Quality Issue - Assembly","missing parts 56394106"
"5 - Quality Issue - Assembly","Main side broom door: difficulty to open and does not click twice when closing. "
"5 - Quality Issue - Assembly","Missing addition UV lights. Please look at photo for reference or ask Benson."
"4 - Quality Issue - Functional","dump door will not open."
"5 - Quality Issue - Assembly","Function Issue: System is not prime correctly - Antifreeze is needed; Unable to insert photo."
"5 - Quality Issue - Assembly","Function Issue: Hopper isn't down all the way - Sensor is set incorrectly "
"5 - Quality Issue - Assembly","Wrong position - Cable should be at 10 and 12 o'clock "
"5 - Quality Issue - Assembly","Missing UV marks on components "
"5 - Quality Issue - Assembly","Incorrect part color; Contact Sajid/ Nick for more information the issue"
"5 - Quality Issue - Assembly","Function Issue: Hopper is not prime w/ Antifreeze - Result: Unable to test Mist Kit"
"5 - Quality Issue - Assembly","Function Issue: Hopper is not prime w/ Antifreeze - Result: Unable to test Mist Kit"
"4 - Quality Issue - Functional","Function Issue: System is not primed correctly, Hose are filled with water - Antifreeze is needed (Red)"
"2 - Quality Issue - Appearance","Surface B: Latch handle is rubbing against rotomold (Hopper Cover) "
"2 - Quality Issue - Appearance","Surface B: Latch handle is rubbing against rotomold (Hopper Cover) "
"5 - Quality Issue - Assembly","Failed Mirror Test: Unable to follow track plans, constantly stopping & moving slow. Error Code 1-055 Lost Comm A-5 Auto"
"5 - Quality Issue - Assembly","Failed Mirror Test: Unable to follow track plans, constantly stopping & moving slow. Error Code 1-055 Lost Comm A-5 Auto"
"4 - Quality Issue - Functional","cannot update multi con"
"4 - Quality Issue - Functional","cannot update multi con"
"5 - Quality Issue - Assembly","Connector not zip tied properly"
"5 - Quality Issue - Assembly","Right door missing warning decal"
"1 - Performance Loss","No serial # in VF"
"4 - Quality Issue - Functional","Drive wheel harness got caught on E brake and was severed."
"5 - Quality Issue - Assembly","Hopper Cover Seal is installed incorrectly."
"5 - Quality Issue - Assembly","Machine is not prime."
"1 - Performance Loss","Machine has mix-match hoses installed."
"1 - Performance Loss","Standard beacon kit with ohg machine"
"4 - Quality Issue - Functional","Camera 3D is seeing phantom objects within recorded path for SC50."
"1 - Performance Loss","Advance CS7010 EcoFlex Decals (56511721) are not installed onto the machine."
"5 - Quality Issue - Assembly","Wrong drain hose color. Came with black which it should be gray."
"1 - Performance Loss","Left Side Broom Assyl is not installed."
"1 - Performance Loss","Right Door Assyl (56511182) is not installed."
"1 - Performance Loss","Right Door Assyl (56511182) is not installed."
"1 - Performance Loss","Machine has mix-matched color hoses installed."
"1 - Performance Loss","Machine has mix-matched colored hoses."
"5 - Quality Issue - Assembly"," Missing 56111607 Debris Tray kit."
"5 - Quality Issue - Assembly","Missing BOM document."
"5 - Quality Issue - Assembly","2d sensor for right side is failing no go."
"5 - Quality Issue - Assembly","2d sensor for right side is failing no go."
"5 - Quality Issue - Assembly","No serial number on visual factory. However it was printed with decal."
"5 - Quality Issue - Assembly","Front left side signal light doesnt work "
"5 - Quality Issue - Assembly","Missing Advance Eco flex decal for solution/recovery tank "
"5 - Quality Issue - Assembly","Missing decals"
"1 - Performance Loss","MO#109066473 needs to be active to be able to clock out in LN."
"5 - Quality Issue - Assembly","missing amber light option."
"4 - Quality Issue - Functional","QR string not cleared"
"4 - Quality Issue - Functional","Autonomy box isn't allowing EOL wifi connection to go through to IOT box. S/N is 2833."
"4 - Quality Issue - Functional","Autonomy box isn't allowing EOL wifi connection to go through to IOT box. S/N is 2833."
"4 - Quality Issue - Functional","Autonomy box isn't allowing EOL wifi connection to go through to IOT box. S/N is 2833."
"5 - Quality Issue - Assembly","SUB 9 does not have the gasket (PL56394243) "
"5 - Quality Issue - Assembly","side broom did not have enough gap between bolts wayne from SUB 10 adjusted "
"2 - Quality Issue - Appearance","missing right side door panel."
"4 - Quality Issue - Functional","Track Clean device is not working in the TrackUnit website. Keyswitch is showing active, but the rest are not. Nic, Sajid, and Jose are working on it to figure out a fix. Springdale might have pre-programmed the module for SC50, but not CS7010. Track CLean PN 56511872."
"4 - Quality Issue - Functional","Unable to set the dump door actuator bracket. Dump door actuator was found to be faulty when it was previously installed on another machine."
"4 - Quality Issue - Functional","Unable to set the dump door actuator bracket. Dump door actuator was found to be faulty when it was previously installed on another machine."
"4 - Quality Issue - Functional","Unable to set the dump door actuator bracket. Dump door actuator was found to be faulty when it was previously installed on another machine."
"5 - Quality Issue - Assembly","Rear Squeegee Guard binds when setting to down position."
"4 - Quality Issue - Functional","right side broom is to low."
"5 - Quality Issue - Assembly",
"5 - Quality Issue - Assembly",
"5 - Quality Issue - Assembly","Solenoid bottom hose is leaking at the connection."
"5 - Quality Issue - Assembly","Solution Hose Clamp is installed incorrectly per Work Instructions."
"4 - Quality Issue - Functional","Fill-in hours are not showing up."
"5 - Quality Issue - Assembly","Right sensor was not within range."
"5 - Quality Issue - Assembly","No battery decals in inventory."
"5 - Quality Issue - Assembly","Solution Hose clamp is installed incorrectly."
"5 - Quality Issue - Assembly","Upper floor mat installed (not ordered)"
"5 - Quality Issue - Assembly",
"5 - Quality Issue - Assembly","Battery decal is out, without it you don't have anything to prop for the other decals."
"5 - Quality Issue - Assembly",
"4 - Quality Issue - Functional","Swapped out Autonomy box due to not reading QR codes. Couldn't connect to EOL. Old S/N is 2833."
"4 - Quality Issue - Functional","Swapped out Autonomy box due to not reading QR codes. Couldn't connect to EOL. Old S/N is 2833."
"4 - Quality Issue - Functional","Swapped out Autonomy box due to not reading QR codes. Couldn't connect to EOL. Old S/N is 2833."
"5 - Quality Issue - Assembly","Missing rear side panel."
"5 - Quality Issue - Assembly","missing 510953 hose, 486112 p-clamp"
"5 - Quality Issue - Assembly","Battery cable is loose from battery."
"5 - Quality Issue - Assembly","Missing UV light mark on screw."
"5 - Quality Issue - Assembly","Clamp wrong position for solution hose."
"5 - Quality Issue - Assembly","Brakes are squeaking when driving."
"5 - Quality Issue - Assembly","Solution Hose Clamp is installed incorrectly per Work Instructions. Main 3."
"5 - Quality Issue - Assembly","Far right screw is striped."
"5 - Quality Issue - Assembly","Decal sticker slightly on the wrong position. Must be a perfect T."
"5 - Quality Issue - Assembly","Both sidebroom dont work "
"4 - Quality Issue - Functional","replaced deck with completed sub for FL639"
"5 - Quality Issue - Assembly","Mixed color hoses is installed on the machine. Cannot ship machine until ALL hoses match colors."
"5 - Quality Issue - Assembly","Mixed color hoses is installed on the machine (56384881). Cannot ship machine until ALL hoses match colors."
"5 - Quality Issue - Assembly","missing intermediate cover 56507565 and engine cover 56507877"
"2 - Quality Issue - Appearance","Scratch marks on battery door"
"5 - Quality Issue - Assembly","Fault Code: 5-F4B6 - No Pattern Projector"
"5 - Quality Issue - Assembly","Fault Code: 5-F4B6 - No Pattern Projector"
"5 - Quality Issue - Assembly","Clamp for the solution hose next to the solenoid in the wrong position."
"5 - Quality Issue - Assembly","Drain Hose Clip is loose."
"5 - Quality Issue - Assembly","Scrub Deck doesn't time out properly."
"4 - Quality Issue - Functional","Main Control Valve is leaking."
"5 - Quality Issue - Assembly","Decals are damaged and have faded lettering."
"1 - Performance Loss","MO#109066169 AND MO#109066170 NEED TO BE ACTIVE TO BE ABLE TO CLOCK OUT IN LN."
"5 - Quality Issue - Assembly","Self-Locking Nut is still loose after rework."
"5 - Quality Issue - Assembly","Ferrite Kit is not installed."
"5 - Quality Issue - Assembly","Recovery Tank Cover Seal is installed inverse. Sharp edge is supposed to be installed inward, and round part outward."
"5 - Quality Issue - Assembly","Bad decal sticker for battery cable."
"5 - Quality Issue - Assembly","Right/left sensors were not in range and left side failed the NO-GO Gauge."
"5 - Quality Issue - Assembly","Float meter fail the NO-GO Gauge."
"5 - Quality Issue - Assembly","Rear squeegee Hose missing clamp"
"2 - Quality Issue - Appearance","Hopper flaps ripped"
"5 - Quality Issue - Assembly","Missing conduit"
"4 - Quality Issue - Functional","Can't put track unit S/N on Verify my trackunit and LN due to the new track unit having a different value of S/N digits."
"5 - Quality Issue - Assembly","Missing extra battery cable (EDC machine)"
"2 - Quality Issue - Appearance","Hydraulic Oil residue underneath Hydraulic pumps."
"5 - Quality Issue - Assembly","Can not enter track clean unit S/N in trackclean unit verify        ( 02012021010616390403 )
 "
"5 - Quality Issue - Assembly","Can not enter track clean unit S/N in trackclean unit verify        ( 02012021010616390403 )
 "
"5 - Quality Issue - Assembly","Can not enter track clean unit S/N in trackclean unit verify        ( 02012021010616390403 )
 "
"5 - Quality Issue - Assembly","Can not enter track clean unit S/N in trackclean unit verify        ( 02012021010616390403 )
 "
"5 - Quality Issue - Assembly","Missing extra battery cable (EDC machine)"
"4 - Quality Issue - Functional","Camera 3D see phantom objects "
"4 - Quality Issue - Functional","Camera 3D see phantom objects "
"4 - Quality Issue - Functional","Camera 3D see phantom objects "
"4 - Quality Issue - Functional","side broom is always on when the engine is on."
"5 - Quality Issue - Assembly","Door for main broom doesnt fit right "
"5 - Quality Issue - Assembly","Rear Squeegee Guard binds on the hinges when lowering."
"5 - Quality Issue - Assembly","Main Broom Door Assembly (56511187) is not aligned properly. Main Broom Door will not close properly."
"5 - Quality Issue - Assembly","Lime green. black and turquoise wire are not positioned correctly. Power cable was put in front of everything."
"5 - Quality Issue - Assembly","Lime green. black and turquoise wire are not positioned correctly. Power cable was put in front of everything."
"5 - Quality Issue - Assembly","Positive and negative power harness is routed wrong, positive is caught between the detergent pump hose and negative is not fed behind the electrical panel."
"5 - Quality Issue - Assembly","Positive and negative power harness is routed wrong, positive is caught between the detergent pump hose and negative is not fed behind the electrical panel."
"5 - Quality Issue - Assembly","Positive and negative power harness is routed wrong, positive is caught between the detergent pump hose and negative is not fed behind the electrical panel."
"5 - Quality Issue - Assembly","Positive and negative power harness is routed wrong, positive is caught between the detergent pump hose and negative is not fed behind the electrical panel."
"5 - Quality Issue - Assembly","Hood top wire assembly is tied wrong and everything was loose."
"5 - Quality Issue - Assembly","Hood top wire assembly is tied wrong and everything was loose."
"5 - Quality Issue - Assembly","Hood top wire assembly is tied wrong and everything was loose."
"5 - Quality Issue - Assembly","Hood top wire assembly is tied wrong and everything was loose."
"5 - Quality Issue - Assembly","Missing 56511827 "
"5 - Quality Issue - Assembly","missing intermediate cover 56507565 and engine cover 56507877"
"5 - Quality Issue - Assembly","Green and pink wire were in the wrong position for the detergent switch."
"5 - Quality Issue - Assembly","FL628 has two different Serial Number: 1000072850 and 1000072880. I believe 1000072850 is the SN for FL628. MO is 100095388. Please advise."
"4 - Quality Issue - Functional","Could not verify if Multicon is functioning. "
"5 - Quality Issue - Assembly","Scrub deck is making a strange noise when spinning. Please double check if passable. "
"5 - Quality Issue - Assembly","Left front laser distance is out of laser position fixture."
"5 - Quality Issue - Assembly","Low battery , needs to be charged "
"5 - Quality Issue - Assembly","Can not Verify trackunit because of new tracking unit kit   (02012021010616394201)
"
"5 - Quality Issue - Assembly","Map and right sensors was not within range."
"5 - Quality Issue - Assembly","LED light strip is not working "
"4 - Quality Issue - Functional","Fault Code: 1-405 (Abort Critical Fault) and 2-041 (M1 Over Current) appears during fill-in.  "
"4 - Quality Issue - Functional","Dust Guard Kit requires functional testing."
"5 - Quality Issue - Assembly","Dust Guard System is not primed with Coolant."
"2 - Quality Issue - Appearance","Hydraulic oil residue on Chassis."
"5 - Quality Issue - Assembly","Both side left and right side fail the No-Go Gauge and right sensor was not within range."
"5 - Quality Issue - Assembly","Float meter failed on the NO-GO Gauge."
"5 - Quality Issue - Assembly","Can not calibrate steering angle "
"5 - Quality Issue - Assembly","Green and pink wire are plug in the wrong position."
"5 - Quality Issue - Assembly","Seat Latch doesn't fully latch on when closing."
"5 - Quality Issue - Assembly","New Dust Filter was installed on machine and tested by EOL. "
"5 - Quality Issue - Assembly","Bad Decal sticker for cable battery."
"5 - Quality Issue - Assembly","Caution decal has air bubble "
"5 - Quality Issue - Assembly","Right sensor is not within range."
"5 - Quality Issue - Assembly","Both right and left wheel encoder fail the NO-GO Gauge. "
"5 - Quality Issue - Assembly","Brake not engaged"
"5 - Quality Issue - Assembly","Right side mist spray is not properly working "
"5 - Quality Issue - Assembly","Wrong charging cord was assembled. Was assembled with an EU cord while, X20D is suppose to be a Disk with an US charging cord."
"5 - Quality Issue - Assembly","Wrong charging cord was assembled. Was assembled with an EU cord while, X20D is suppose to be a Disk with an US charging cord."
"5 - Quality Issue - Assembly","Missing debris basket "
"5 - Quality Issue - Assembly","Missing ecoflex bottle and need to take of the test bottle "
"5 - Quality Issue - Assembly","Left 2D sensor flicker "
"5 - Quality Issue - Assembly","Left 2D sensor flicker "
"5 - Quality Issue - Assembly","Loose cable next to engine "
"5 - Quality Issue - Assembly","Engine cover assy is hitting the roller bumper "
"4 - Quality Issue - Functional","mist kit do not work."
"5 - Quality Issue - Assembly","Missing Ferrite-Kit "
"5 - Quality Issue - Assembly","Both positive and negative of battery power harness is routed wrong and not sitting behind electrical plate, negative being routed behind UVGI cord and actuator shaft, while positive being behind detergent hose."
"5 - Quality Issue - Assembly","Both positive and negative of battery power harness is routed wrong and not sitting behind electrical plate, negative being routed behind UVGI cord and actuator shaft, while positive being behind detergent hose."
"1 - Performance Loss","MO#100096011 needs to be active to be clocked out in LN."
"5 - Quality Issue - Assembly","3D camera faild to calibrate. 5-F4a1 Bad 3D vision sens cal, 5-F5BD 3D sens intrfc down, 5-F4AB Camera roll bound fail ."
"5 - Quality Issue - Assembly",
"5 - Quality Issue - Assembly","Fault code 5-F4B6, No pattern Projector. 3D camera keep stopping on copy cat plan. Camera S/N 7925"
"5 - Quality Issue - Assembly","Fault code 5-F4B6, No pattern Projector. 3D camera keep stopping on copy cat plan. Camera S/N 7925"
"5 - Quality Issue - Assembly","Fault code 5-F4B6, No pattern Projector. 3D camera keep stopping on copy cat plan. Camera S/N 7925"
"1 - Performance Loss","Right Door Assyl (56511182) is not installed due to warehouse parts shortage."
"1 - Performance Loss","Right Door Assyl (56511182) is not installed due to warehouse parts shortage."
"4 - Quality Issue - Functional","engine won't start"
"4 - Quality Issue - Functional","engine won't start"
"4 - Quality Issue - Functional","engine won't start"
"4 - Quality Issue - Functional","engine won't start"
"5 - Quality Issue - Assembly","Missing Debris Basket and Hopper"
"5 - Quality Issue - Assembly","Radiator Residue "
"5 - Quality Issue - Assembly","Right side door: Loose part"
"5 - Quality Issue - Assembly","Loose Bolt (See Video for additional information)"
"5 - Quality Issue - Assembly","Loose cable on actuator (Underneath Machine)"
"5 - Quality Issue - Assembly","Missing Prop 65 Decal "
"5 - Quality Issue - Assembly","Missing Prop 65 Decal "
"5 - Quality Issue - Assembly","Misalignment "
"5 - Quality Issue - Assembly","Critical Issue: Dump Door failed function test. Actuator spring is touching metal weldment  "
"5 - Quality Issue - Assembly","Damaged Decal "
"2 - Quality Issue - Appearance","Appearance Issue: Paint Chip"
"2 - Quality Issue - Appearance","Appearance Issue: Paint Chip"
"5 - Quality Issue - Assembly","System is not prime correctly."
"5 - Quality Issue - Assembly","Critical Issue: Loose Screw on control panel. Marked w/ red tape "
"5 - Quality Issue - Assembly","Critical Issue: Missing Track Clean Unit"
"5 - Quality Issue - Assembly","Negative black battery cable is fed through the wrong position and routed before the electrical panel, it is ideally suppose to be behind the UVGI cord or actuator shaft."
