"Symptom Type","Reporter Comment"
"5 - Quality Issue - Assembly","N089/SC6500: Side Broom Actuator retracted position does not pass the JIG."
"Assembly Issue","FL806 Terminal is displaying a warning, ""Exception caught when rendering vehicle plugin"" - see image for more detail."
"4 - Quality Issue - Functional","SW8000/M254 backup alarm turns on when turning the main broom on too "
"5 - Quality Issue - Assembly","N089/SC6500: Rear Squeegee Actuator extended length did not pass the JIG."
"2 - Quality Issue - Appearance","M320: hydraulic drive pump is not clean from bottom surface."
"5 - Quality Issue - Assembly","M320: gasket in wrong position. Shape edge should inside, not out."
"Assembly Issue","N384 SC6500 - machine is a EDC but the machine configuration/programming was set as Domestic ( Advance) setting instead of international (Nilfisk) setting "
"5 - Quality Issue - Assembly","M320: hour meter is only 0.6. Machine required 1.0 for hour meter."
"Assembly Issue","SW8000/M254 - Backup alarm keeps ringing when you turn machine on and is in rabbit mode, put the broom down and step on the pedal once."
"Assembly Issue","FL806 SC50 detects Fault code 5-E4B1 A5 Unknown Error. This fault code is non existent on Liberty Service Manual.pdf "
"5 - Quality Issue - Assembly","M320: missing hopper debris."
"5 - Quality Issue - Assembly","M320: decal is not aligned from support steering wheel."
"4 - Quality Issue - Functional","N383/SC6500: Solution Hose busted during drive test. EOL tightened back the lower hose to the Scrub Deck. But now, it's slowly leaving puddles as if it's clogged, which would make sense, to what happened. Refer to pictures."
"Assembly Issue","N387 SC6500 - damaged rear decal 56016731 "
"5 - Quality Issue - Assembly","CS7010/M622 washer for the recovery tanks is off showing a hole on it "
"Assembly Issue","N386 SC6500 - doesnt have decal 56015272 on the back of the seat "
"5 - Quality Issue - Assembly","SW8000/M254 strainer relief is loose "
"5 - Quality Issue - Assembly","SW8000/M254 upper hopper bracket latch is hitting the upper hopper "
"4 - Quality Issue - Functional","CS7010/M621 dump door actuator is making a weird sound when opening "
"Assembly Issue","Needs battery tray - Parts are in QA"
"Assembly Issue","Left Caliper is loose making noise during drive"
"4 - Quality Issue - Functional","FL823: during FIll-In, machine stop 4 time. Configuration the camera, power cycle, and made a new Fill-In course. Run it for the 2nd time, it stop once. The 3rd tried with the new squeegee and it stop 3 time. Scrub deck also making distortion noises when active and when it stop."
"5 - Quality Issue - Assembly","CS7010/M620 is missing the grilled-right "
"4 - Quality Issue - Functional","FL823: during camera test, machine lost course path. Tested the 2nd time, machine runs normal. "
"4 - Quality Issue - Functional","FL823: during camera test, machine lost course path. Tested the 2nd time, machine runs normal. "
"Assembly Issue","FL806 LED light strip is not glowing and functioning unless running plan saved track."
"Assembly Issue","FL806 SC50 is yielding fast at corners of the saved plan when running track. Plan is unable to be saved after deleting tag and rebooting SC50 for camera on option."
"5 - Quality Issue - Assembly","CS7010/M620 is missing the engine cover "
"5 - Quality Issue - Assembly","CS7010/M618 is missing ferrite-Kit."
"5 - Quality Issue - Assembly","SC8000/M320 SUB1 & SUB 3 still open on VF"
"2 - Quality Issue - Appearance","N383/SC6500: Vac Cover has stains on it."
"4 - Quality Issue - Functional","N383/SC6500: Possible leak coming from front of the Scrub Deck. It's leaving puddles everywhere it goes. Check for clogging, because it's a drop system. If clogged, this is what would have caused the solution hose to burst open before during the Drive Test."
"5 - Quality Issue - Assembly","CS7010/M619 still open on sub 3 and EOL"
"2 - Quality Issue - Appearance","N385/SC6500: Pedal has some stains on it from stepping on the Wash Bay area."
"5 - Quality Issue - Assembly","N385/SC6500: Solution System is not primed with coolant."
"2 - Quality Issue - Appearance","N385/SC6500: Exhaust Cover has dents."
"5 - Quality Issue - Assembly","N385/SC6500: Recovery Tank Cover doesn't lock in place. Please adjust the Cover outwards more."
"Assembly Issue","FL807 Right side Nilfisk SC50 decal is missing."
"Assembly Issue","no hinge 56383699"
"5 - Quality Issue - Assembly","CS7010/M619 prop rod latch is not locking "
"Assembly Issue","FL823 Possible leak from drain hose. Either needs to be clamped down better or there is a hole in the hose."
"4 - Quality Issue - Functional","CS7010/M619  DRIVE WHEEL IS ACTING UP  this could be related it to this fault code 3-096 Parameter Change Critical The module’s output mode was improperly changed."
"Part Shortage","N364/SC6500: Battery Tray is not installed. Parts Shortage."
"Part Shortage","no battery tray"
"5 - Quality Issue - Assembly","N027/SC6500: Side Skirt Knobs have not been adjusted correctly according to the Work Instructions. Please refer to the work instructions for installation."
"5 - Quality Issue - Assembly","N365/SC6500: Solution Tank Cover is hard to close and open. Please adjust the Cover outwards more."
"5 - Quality Issue - Assembly","N365/SC6500: Parking Brake Lever is binding against the Floor Weldment."
"5 - Quality Issue - Assembly","N364/SC6500: Solution Tank Cover is hard to close, and hard to open. Please adjust the Cover outwards a little bit."
"5 - Quality Issue - Assembly","N364/SC6500: Parking Brake Lever is binding against the floor weldment."
"Assembly Issue","drive wheel turns left , right when machine key on 
"
"Assembly Issue","CS7010/M618 - Missing cover cap for wheels."
"3 - Quality Issue - Supplier","CS7010/M618 HAS A BUMP ON ENGINE COVER "
"Assembly Issue","upper engine cover has big bump "
"4 - Quality Issue - Functional","CS7010/M621 - main broom  won't go up or down, and right now its at the lowest. needs adjustment "
"Assembly Issue","CS7010/M621 - Leaking water under machine"
"Assembly Issue","CS7010/M621 - Scrub deck/ middle scrub won't go up or down, and right now its at the lowest. "
"5 - Quality Issue - Assembly","SW8000/M235 missing warning decal."
"2 - Quality Issue - Appearance","M246: minor dust in hopper. Need to be clean."
"5 - Quality Issue - Assembly","M246: missing decal for mist kit switch."
"5 - Quality Issue - Assembly","M246: decal for main broom door is not aligned."
"5 - Quality Issue - Assembly","M815/SW8000: Dust Flap has cross threaded hardware. Can't remove or screw in. Stuck at the very top position."
"5 - Quality Issue - Assembly","M815/SW8000: Main Broom Warning Decal is installed crooked."
"5 - Quality Issue - Assembly","M815/SW8000: ZTR Serial Number is not scanned into ZTR website."
"5 - Quality Issue - Assembly","M246: missing engine cover."
"Assembly Issue","FL823 SC50 is stopping on fill-in track continuously. Checked on Linux, sometimes it sees phantom objects, sometimes it just stops at curves inside the fill-in, no explanation as to why."
"5 - Quality Issue - Assembly","SW8000/ M235 Main broom decal is not sticking correctly."
"Assembly Issue","Solution tube for Rev deck is too long. -Benson FQC"
"Part Shortage","no hinge (56383699) for engine cover "
"5 - Quality Issue - Assembly","M246: missing Fire Extinguisher Kit."
"2 - Quality Issue - Appearance","M246: coolant container is not clean."
"5 - Quality Issue - Assembly","SW8000/M235 missing shipping serial number in VF"
"Part Shortage","missing engine cover 56507877"
"Assembly Issue","N387/Sc6500- Missing rear side panel "
"Assembly Issue","N387/Sc6500- Missing battery tray"
"5 - Quality Issue - Assembly","N386/SC6500: Parking Brake Pedal is rubbing against the Floor Weldment."
"Assembly Issue","N387/Sc6500- steering wheel chain is to tight"
"Assembly Issue","N387/Sc6500- Forgot to installed right side bumper assy.. And also put the wrong bumper assy on left side"
"Assembly Issue","N387/Sc6500- Decal (56016348) is not on center it more far to the left"
"5 - Quality Issue - Assembly","N383/SC6500: Recovery Tank Lanyard is loose."
"Part Shortage","N383/SC6500: Battery Tray is not installed."
"Part Shortage","N383/SC6500: Rear Side Panel is not installed."
"Part Shortage","N385/SC6500: Rear Side Panel is not installed."
"Part Shortage","N385/SC6500: Battery Try is not installed. *Parts Shortage*"
"Assembly Issue","CS7010/M620 - Left side broom is higher than right side. "
"1 - Performance Loss","N384/SC6500: Rear Side Door is not installed. Parts shortage.
*This machine is missing hardware is in EOL Rework. It's not supposed to be clocked out of EOL yet.*"
"5 - Quality Issue - Assembly","N384/SC6500: Recovery Tank Lanyard is loose.
*This Issue was found in EOL Rework. It's not supposed to be clocked out of EOL yet.*"
"Part Shortage","No Hinge (56383699) for engine cover from SUB 9"
"Part Shortage","missing hopper cover cs7010"
"Assembly Issue","SW8000-M246-moves back sometimes after pressing the peddle "
"Assembly Issue","SW8000-M246-back up alarm goes off when pressed hard."
"5 - Quality Issue - Assembly","SC6500/N373 recovery tank touching support chassis."
"Assembly Issue","N383 SC6500 - Missing side broom amp causing side brooms to not function "
"Assembly Issue","no engine cover  56107579"
"Assembly Issue","CS7010/M619 - Left side broom is higher than right side broom."
"Part Shortage","out  of parts- Battery tray"
"2 - Quality Issue - Appearance","SW8000/M235 solution tank has a leak "
"Assembly Issue","CS7010-M618-leaking form filter"
"Assembly Issue","SW8000-M235- solution tank is leaking "
"4 - Quality Issue - Functional","SW8000-M815-back up alarm will go off when not in reverse"
"4 - Quality Issue - Functional","SW8000/M235 did not stared but Nick just did a bypass and it work we will wait and if start without a bypass we will send it"
"5 - Quality Issue - Assembly","N385/SC6500: Parking Brake Pedal binds against Floor Weldment."
"4 - Quality Issue - Functional","SW8000/M235 did not stared but Nick just did a bypass and it work we will wait and if start without a bypass we will send it 
"
"Assembly Issue","M235/SW8000 - Engine is not starting. "
"Assembly Issue","no hinge 56383699"
"5 - Quality Issue - Assembly","FL824/SC50: Loose connection on Camera."
"Assembly Issue","SW8000-M815-back up alarm will go off when not in reverse "
"Part Shortage","missing engine cover 56507877"
"3 - Quality Issue - Supplier","CS7010/M618 it looks like the Arm-Deck Lift Assembly is bend might need to be replaced it "
"3 - Quality Issue - Supplier","M815/SW8000: First issue stated ""EGO2: NG"". Now there is no response coming from the ECU. Trying to figure out if it's the cable or the engine. Will wait for 2nd Hot Test on 2nd machine of the day. Will update through comments"
"3 - Quality Issue - Supplier","M815/SW8000: First issue stated ""EGO2: NG"". Now there is no response coming from the ECU. Trying to figure out if it's the cable or the engine. Will wait for 2nd Hot Test on 2nd machine of the day. Will update through comments."
"Assembly Issue","no engine cover 56107579"
"5 - Quality Issue - Assembly","SW8000/M618  SUB 2&3 STILL OPEN ON VF AND MAIN 9 "
"Assembly Issue","SW8000-M815- test fail. code ""EGO2 Value is NG"""
"3 - Quality Issue - Supplier","M619/CS7010: When building the Hopper at SUB 10, the built Hopper did not pass the gap test/JIG, verify if the Hopper doesn't grind plastic on plastic when installed at MAIN 7."
"Part Shortage","CS7010: Grease caps do not fit the wheels."
"5 - Quality Issue - Assembly","CS7010/M1006 IT DOES NOT CALL FOR DELUX SEAT"
"Assembly Issue","CS7010/M618 - Left side under-broom isn't budging/stuck."
"5 - Quality Issue - Assembly","Dump door hitting hopper on both sides"
"Part Shortage","no hinge 56383299 for engine cover Sub 9  "
"5 - Quality Issue - Assembly","Dump door opening past plastic "
"Assembly Issue","FL806 Sc50 Liberty - S/N 0008532 3D camera failed to calibrate but was working before on a different machine "
"5 - Quality Issue - Assembly","CS7010/M1006 IS MISSING THE RECOVERY HOSE "
"5 - Quality Issue - Assembly","CS7010/M616 has a filter leak and loose"
"Assembly Issue","N372/Sc6500- Out of parts Rear side panel (56414106)"
"Assembly Issue","FL806 SC50 liberty - 2-021 M1 open due to no rev scrub deck adapter "
"5 - Quality Issue - Assembly","CS7010/M1006 missing spring gas for the engine cover "
"5 - Quality Issue - Assembly","CS7010/M1006 SUB 2 AND 3 ARE STILL OPEN ON VF "
"5 - Quality Issue - Assembly","CS7010/m1006 hopper cover gasket is placed it outside in "
"5 - Quality Issue - Assembly","CS7010/M617 HOPPER cover gasket is placed it outside in "
"Part Shortage","missing hopper cover cs7010 "
"Part Shortage","CS7010-M617- missing decal part # 56511722"
"Assembly Issue","N372/Sc6500- Recovery tank rubbing on support bar"
"5 - Quality Issue - Assembly","CS7010/M614 STRAIN RELIF IS LOOSE "
"5 - Quality Issue - Assembly","CS7010/M614 SUB 1 AND 2 STILL OPEN ON VF "
"5 - Quality Issue - Assembly","CS7010/M617 SUB1,SUB2,SUB3 STILL OPEN ON VF "
"Assembly Issue","N372/Sc6500- steering wheel chain is loose"
"Assembly Issue","N372/Sc6500- Seat belt kit is loose "
"3 - Quality Issue - Supplier","7765/M1096: The Seat Latch Assyl doesnt latch properly when dropping the seat down."
"5 - Quality Issue - Assembly","7765/M1096  neutral is off, moving forward slowly."
"Assembly Issue","CS7010-M614-missing decal "
"5 - Quality Issue - Assembly","FL800: scrub deck height fail the NO-GO Jig."
"5 - Quality Issue - Assembly","N373/SC6500: Incorrect resistor is installed onto the wrong machine. It's supposed to be 48"" Resistor, but it has a 40"" installed."
"5 - Quality Issue - Assembly","N372/SC6500: The incorrect resistor was installed which made the machine think it's a 40"" Machine instead of a 48""."
"5 - Quality Issue - Assembly","Loose bolt on rec tank lid"
"Assembly Issue","FL799 3D camera is seeing phantom objects, causing SC50 to continuously stop on fill-in track. 12:27 PM Problem was logged on menu option. Autonomy module SN is 0008601. 3D Camera SN is 0008542."
"Assembly Issue","FL799 3D camera is seeing phantom objects, causing SC50 to continuously stop on fill-in track. 12:27 PM Problem was logged on menu option. Autonomy module SN is 0008601. 3D Camera SN is 0008542."
"5 - Quality Issue - Assembly","N361: decal in wrong position."
"5 - Quality Issue - Assembly","N361: Recovery tank still touch weldment.  Verified FQC Benson"
"5 - Quality Issue - Assembly","SC50/FL799 camera see photon objects multiple time during fill-in. Might need to check camera."
"5 - Quality Issue - Assembly","M475: weldment is touch with lower hopper."
"5 - Quality Issue - Assembly","M475: missing decal for backup alarm."
"5 - Quality Issue - Assembly","M475: missing debris basket."
"Assembly Issue","programing shows its a different machine type"
"Assembly Issue","FL800 3D camera is stopping on copycat and trying to go out of the course. S/N 0007063 This camera came back from Carnegie Robotics. There is a rework report attached to the camera box displaying that there were no problems. October 22 9:39 AM 2021. Autonomy module SN is 0008602."
"5 - Quality Issue - Assembly","N372/SC6500: Decal is installed crooked."
"Assembly Issue","CS7010-M616-machine is not primed"
"Part Shortage","CS7010/M616 - No more decal - Nilfisk 56511722"
"Assembly Issue","N361/Sc6500- Missing hole for beacon kit"
"5 - Quality Issue - Assembly","N361/SC6500: Recovery Tank Lanyard is loose."
"5 - Quality Issue - Assembly","N361/SC6500: Exhaust Cover is damaged from rubbing against the Chassis.
Root cause is from Harness being installed too tight."
"5 - Quality Issue - Assembly","SC6500/N360 has deep scratch on recovery tank cover."
"5 - Quality Issue - Assembly","SC6500/N360 has loose lanyard nut."
"Assembly Issue","FL800 3D Camera isn't calibrating 8:18 AM 10/22/2021. Autonomy module SN 0008602. Every time when trying to apply QR cod/ip address through the 3D camera. Autonomy fails in software update menu. Autonomy was already booted up before bringing up software update menu."
"Assembly Issue","CS7010-M475-can not prime with no red water "
"Assembly Issue","N360-Sc6500: Recovery tank have a scratch already put red tape on it"
"Assembly Issue","CS7010-M542-can not prime because we ran out of the red water "
"5 - Quality Issue - Assembly","CS7010/M615 has a leakage from the filter."
"Assembly Issue","N360-Sc6500: Squeegee actuator height is to high need to set a bit lower"
"Assembly Issue","M541/CS7010 - Machine doesn't have the door for the recovery tank. "
"5 - Quality Issue - Assembly","N360/SC6500: Rear Squeegee doesn't go all the way down. Please rotate Rear Squeegee Actuator Settings 1-click to the right."
"Assembly Issue","dump door won't close. unable to set the actuator bracket,."
"5 - Quality Issue - Assembly","M613: missing caution decal."
"3 - Quality Issue - Supplier","N372/SC6500: Front Bumper doesn’t align properly with Solution Tank Mold."
"4 - Quality Issue - Functional","CS7010/M615 light wire is loose need to be reworked by Nick "
"Assembly Issue","N360-Sc6500: Rear squeegee strap is upside down "
"Assembly Issue","N360-Sc6500: Decal 560016348 is crooked need to be on center "
"Assembly Issue","CS7010/M615 - Right side headlight isn't turning on."
"5 - Quality Issue - Assembly","N360/SC6500: Rear Squeegee Assyl is assembled incorrectly."
"Assembly Issue","FL799 SC50 - unable to update firmware to 4.06 . can't scan QR code and/or unable to detect USB. power cycle and still no changes "
"Assembly Issue","M615/CS7010 - Shaker isn't working"
"5 - Quality Issue - Assembly","N360/SC6500: Rear Squeegee Assyl is assembled incorrectly."
"1 - Performance Loss","FL823/SC50 - This is an ARAMARK (customer) unit. Please pay special attention to quality and leave this issue open until Production Review. "
"5 - Quality Issue - Assembly","CS7010/M615 SIDE BROOM IS TO HIGH "
"5 - Quality Issue - Assembly","CS7010/M613 SIDE BROOM ARE TO HIGH "
"Part Shortage",
"Part Shortage","missing hopper front cs7010 m616"
"5 - Quality Issue - Assembly","Missing no-step decals on scrub deck"
"5 - Quality Issue - Assembly","CS7010/M613 HAS A LEAK FROM FILTER "
"Assembly Issue","CS7010-M613- leaking solution filter "
"Assembly Issue","M612/CS7010 - Left side broom is higher than right side broom."
"5 - Quality Issue - Assembly","CS7010/M613 SUB 1 AND SUB 10 STILL OPEN ON VF "
"5 - Quality Issue - Assembly","CS7010/M613 PROP ROD IS MISSING WASHER "
"5 - Quality Issue - Assembly","N032: drive wheel chain is loose."
"5 - Quality Issue - Assembly","N032: screw is strip from left side recovery tank."
"5 - Quality Issue - Assembly","N032: missing floor mat kit."
"5 - Quality Issue - Assembly","N360/SC6500: Parking Brake Lever is binding against the floor weldment."
"Assembly Issue","N034-Sc6500: Recovery tank rubbing on solution tank need to be adjusted "
"5 - Quality Issue - Assembly","CS7010/M529 dust fan has a loose screw and washer."
"5 - Quality Issue - Assembly","CS7010/M529 has a leakage from the filter."
"5 - Quality Issue - Assembly","Cable kit is missing boots"
"5 - Quality Issue - Assembly","N034/SC6500: Solution Tank Cover is not closing properly. It's in the wrong position."
"5 - Quality Issue - Assembly","LibertySC50/ FL797 screw for autonomous loose."
"5 - Quality Issue - Assembly","Backup alarm installed without order"
"4 - Quality Issue - Functional","CS7010/M529 SCRUB DECK OUT IS NOT CEROING OUT BEFORE DECK "
"Assembly Issue","CS7010/MO100095848 - Left side broom is much higher than right side broom. "
"Assembly Issue","CS7010/MO100095848 - Parking break signal is on even though parking break is not being engaged."
"5 - Quality Issue - Assembly","M528: nonconformance- scrub deck actuator does not time out correctly."
"5 - Quality Issue - Assembly","Wrong decal"
"5 - Quality Issue - Assembly","M528: screw is strip from hose clamp."
"5 - Quality Issue - Assembly","M471: missing decal for hopper."
"5 - Quality Issue - Assembly","Dump door is sticking/scraping against inside of hopper"
"3 - Quality Issue - Supplier","N033/SC6500: Electrical Panel cannot be set correctly due to the location of the inserts. An investigation will be needed by IQC."
"5 - Quality Issue - Assembly","N360/SC6500: Missing entire Rear Squeegee Assembly."
"5 - Quality Issue - Assembly","N360/SC6500: Missing entire Rear Squeegee Assembly."
"Assembly Issue","N032-Sc6500: Floor mat is crooked"
"3 - Quality Issue - Supplier","SHAFT, LOWER STEERING (56413175) is out of specifications per print. They are too small:
Measured 0.1850/ 0.1880+/-17.
KEY (56003228) are exactly 0.1880 in width, meaning they are not able to fit in for installation.
Hammering them in causes warping, and leads to unable to install Sprocket."
"5 - Quality Issue - Assembly","N188: missing serial number from visual factory."
"5 - Quality Issue - Assembly","M1095: filter decal was facing in and not out."
"2 - Quality Issue - Appearance","N348: right side skirt is damage. Need a need side skirt."
"Part Shortage","Need part number 56510756 - Decal Filter Hanger Shaker for CS7010. "
"Assembly Issue","N032-Sc6500: Missing power cable "
"4 - Quality Issue - Functional","CS7010/M529 dump door actuator is not working , nick is working on it "
"Assembly Issue","N032-Sc6500: Rear squeegee strap is upside down... This is like the 10X  that had happen "
"Assembly Issue","N032-Sc6500: Break was to tight need to adjusted it"
"Assembly Issue","dump door won't open. possible faulty actuator."
"4 - Quality Issue - Functional","alternator in not charging the battery "
"2 - Quality Issue - Appearance","M1095: decals are peeling off and out of aligned."
"2 - Quality Issue - Appearance","N1095: hopper is not clean and should be using test filter when testing, not new filter"
"2 - Quality Issue - Appearance","N348: right side skirt needs to be clean or need a new skirt."
"5 - Quality Issue - Assembly","N348: missing side panel door."
"5 - Quality Issue - Assembly","N348: zip tie end is not cut."
"5 - Quality Issue - Assembly","N348: machine do not require a floor mat kit."
"2 - Quality Issue - Appearance","N348: screw is strip from the right rear side recovery tank."
"5 - Quality Issue - Assembly","Brake not engaged"
"5 - Quality Issue - Assembly","M348: recovery tank is touching the weldment."
"5 - Quality Issue - Assembly","M348: lanyard nut is loose."
"1 - Performance Loss","N188: missing data for serial number from visual factory."
"5 - Quality Issue - Assembly","N188: screw is strip from left rear side of the recovery tank."
"2 - Quality Issue - Appearance","N188: decals is not aligned."
"Assembly Issue","N348 SC6500 - left side skirt is damage , its rubbing against the wheel "
"5 - Quality Issue - Assembly","N032/SC6500: Solution Tank Cover will not close because it's set too far inward."
"Assembly Issue","N348 SC6500 - both side brooms height is to low "
"5 - Quality Issue - Assembly","M527: side broom brush from left side is on the wrong position when brushing down."
"Part Shortage","7765/M1096missing drive compartment from sub 12 
"
"Assembly Issue","N348/SC6500: Electrical Panel is off and rubbing against the fuses by a lot."
"5 - Quality Issue - Assembly","M527: loose part."
"2 - Quality Issue - Appearance","M527: decal is touching bracket."
"Assembly Issue","N348-Sc6500: steering decal is off center, decal on the gray plastic "
"Assembly Issue","N188-Sc6500: Leaking needed to be fix"
"Assembly Issue","Awaiting for 5.02 firmware update USB drive from ZJ."
"5 - Quality Issue - Assembly","FL796/SC50: Power Module has a loose connector."
"5 - Quality Issue - Assembly","FL796/SC50: P-Clamp on solution hose is installed upside down."
"Assembly Issue","N188-Sc6500: Steering wheel chain to tight need to be a bit loose "
"Assembly Issue","N188-Sc6500:Both side of the side squeegee missing the small blade..."
"Assembly Issue","CS7010-M527-scanned the no instead of the serial number "
"Assembly Issue","FL795 3D camera calibration corner FAILED.
Fault codes - (5-F4A1 Bad 3D Vision Sens Cal) (5-F4A8 Camera X Bound Failed) (5-F4AB Roll bound Fail) (5-F4A9 Camera Y Bound Failed)"
"Part Shortage","missing hopper cover cs7010 "
"Assembly Issue","N188-Sc6500:deck brush keep coming off.."
"5 - Quality Issue - Assembly","M257 sub 3 still open "
"5 - Quality Issue - Assembly","M527 Scrub deck is not timing off when pressing down "
"2 - Quality Issue - Appearance","M159/SC8000: hydraulic oil residue underneath drive pumps."
"2 - Quality Issue - Appearance","M526/SC8000: Oil residue underneath drive pumps."
"5 - Quality Issue - Assembly","M159: machine does not require deluxe seat."
"5 - Quality Issue - Assembly","M159: Main 10 from visual factory is open"
"3 - Quality Issue - Supplier","M159: battery is low. Possible bad alternator. EOL"
"5 - Quality Issue - Assembly","M159: not prime."
"5 - Quality Issue - Assembly","M159: wrong serial number"
"4 - Quality Issue - Functional","M526: nonconformance- scrub deck actuator does not time out correctly."
"5 - Quality Issue - Assembly","M526: gasket for hopper is in stall wrong. Sharp edge should be facing in, not out."
"5 - Quality Issue - Assembly","M526: distortion noises when operating the hopper to go down due to metal against metal. Approved by Abe X. for future observation.  "
"Part Shortage","SC8000-M159-missing screen weldment part number 56111751"
"5 - Quality Issue - Assembly","M526/CS7010: loose bolt with washer from recovery tank latch."
"Part Shortage","SC8000-M159-missing part number 56110775-box weld. chemical bottle "
"5 - Quality Issue - Assembly","No serial number in vf 😢"
"Part Shortage","Harness-Battery Power are made incorrectly by Supplier. Bad batch."
"Assembly Issue","SC8000-M159-leaking above solution filter "
"Assembly Issue","FL794 SC50 - steering wheel is stiff "
